a_id,b_id,a_title,b_title,hamming,a_src,b_src
9c34050c-c61f-4a93-ae08-f687d8cbd677,9c34050c-c61f-4a93-ae08-f687d8cbd677,Trump’s Chip Tariff Threat Sparks Pushback From Auto Industry To Tech,Trump’s Chip Tariff Threat Sparks Pushback From Auto Industry To Tech,0,GOLD,MARKETAUX
fe2a00ef-3e66-432c-8ec4-809e6b23f434,fe2a00ef-3e66-432c-8ec4-809e6b23f434,Bottom Is Out: AMD Has No AI GPU Growth To Brag About (Rating Upgrade) (NASDAQ:AMD),Bottom Is Out: AMD Has No AI GPU Growth To Brag About (Rating Upgrade) (NASDAQ:AMD),0,GOLD,MARKETAUX
161c1e89-066c-4603-972f-425c837f9370,161c1e89-066c-4603-972f-425c837f9370,Where Is SoFi Heading in 2025? 3 Bold Predictions for Investors,Where Is SoFi Heading in 2025? 3 Bold Predictions for Investors,0,GOLD,MARKETAUX
263c1056-9cde-46b2-97c0-2dc08c64ad7f,263c1056-9cde-46b2-97c0-2dc08c64ad7f,"1 Beaten-Down Stock That Could Soar by 50% in 2025, According to Wall Street","1 Beaten-Down Stock That Could Soar by 50% in 2025, According to Wall Street",0,GOLD,MARKETAUX
43a5a28d-4628-4060-9e74-53e98cdc12f1,43a5a28d-4628-4060-9e74-53e98cdc12f1,Analyzing NVIDIA In Comparison To Competitors In Semiconductors & Semiconductor Equipment Industry - NVIDIA (NASDAQ:NVDA),Analyzing NVIDIA In Comparison To Competitors In Semiconductors & Semiconductor Equipment Industry - NVIDIA (NASDAQ:NVDA),0,GOLD,MARKETAUX
eecf06ae-af33-4cd6-9c6e-61dc2f17e643,eecf06ae-af33-4cd6-9c6e-61dc2f17e643,"Predicting The S&P 500 With An 85% Correlation - iShares Core S&P 500 ETF (ARCA:IVV), SPDR S&P 500 (ARCA:SPY)","Predicting The S&P 500 With An 85% Correlation - iShares Core S&P 500 ETF (ARCA:IVV), SPDR S&P 500 (ARCA:SPY)",0,GOLD,MARKETAUX
72218c92-78b0-429f-94d1-0733b9cec3ff,72218c92-78b0-429f-94d1-0733b9cec3ff,This Is What Whales Are Betting On Advanced Micro Devices - Advanced Micro Devices (NASDAQ:AMD),This Is What Whales Are Betting On Advanced Micro Devices - Advanced Micro Devices (NASDAQ:AMD),0,GOLD,MARKETAUX
1ae50b6e-0ed3-4e15-acd5-a6d0f457cd7c,1ae50b6e-0ed3-4e15-acd5-a6d0f457cd7c,Analysts see Israel-linked Nebius challenging CoreWeave,Analysts see Israel-linked Nebius challenging CoreWeave,0,GOLD,MARKETAUX
c24ce014-ede0-42cc-8dd3-b159a46ba48e,c24ce014-ede0-42cc-8dd3-b159a46ba48e,Nasdaq 100’s Worst Quarter In Years Sealed By AI Bubble Fears,Nasdaq 100’s Worst Quarter In Years Sealed By AI Bubble Fears,0,GOLD,MARKETAUX
5cf0532c-e9a4-49b2-9e08-0b5d699d9dc3,5cf0532c-e9a4-49b2-9e08-0b5d699d9dc3,Canada Has A Lot To Lose If Carney Tilts To Europe - NVIDIA (NASDAQ:NVDA),Canada Has A Lot To Lose If Carney Tilts To Europe - NVIDIA (NASDAQ:NVDA),0,GOLD,MARKETAUX
c13d7af5-5696-4cb7-b4b4-7129fe3a5050,c13d7af5-5696-4cb7-b4b4-7129fe3a5050,Samsung Q4 earnings expected to be hit by Nvidia AI chip supply delay By Reuters,Samsung Q4 earnings expected to be hit by Nvidia AI chip supply delay By Reuters,0,GOLD,MARKETAUX
c6929f16-c4a3-4ba1-a6fe-4757b5308250,c6929f16-c4a3-4ba1-a6fe-4757b5308250,An In-Depth Look at the Burgeoning FPGA Security Market,An In-Depth Look at the Burgeoning FPGA Security Market,0,GOLD,MARKETAUX
b1dac305-7c7c-4940-ab5c-ad51b4016546,b1dac305-7c7c-4940-ab5c-ad51b4016546,NVIDIA (NVDA) Surges Amid AI Chip Deal with Saudi Arabia,NVIDIA (NVDA) Surges Amid AI Chip Deal with Saudi Arabia,0,GOLD,MARKETAUX
1c739d76-be7c-47f5-b78c-af0fd7db80fa,1c739d76-be7c-47f5-b78c-af0fd7db80fa,Big Tech’s Q1 Blowout Can’t Hide Bubble-Level Valuations,Big Tech’s Q1 Blowout Can’t Hide Bubble-Level Valuations,0,GOLD,MARKETAUX
689711a6-3be0-488f-83e1-ff8d7ddd94bb,689711a6-3be0-488f-83e1-ff8d7ddd94bb,Why I bought a LOT of ASX technology shares,Why I bought a LOT of ASX technology shares,0,GOLD,MARKETAUX
e3489cf9-1a5a-40a1-949b-b464aacc4ccc,e3489cf9-1a5a-40a1-949b-b464aacc4ccc,Nvidia’s Transition to Full-Stack AI May Justify $200+ Price Targets,Nvidia’s Transition to Full-Stack AI May Justify $200+ Price Targets,0,GOLD,MARKETAUX
a12ccdee-cf68-4009-beb2-5b5248e0c22b,a12ccdee-cf68-4009-beb2-5b5248e0c22b,"How major US stock indexes fared Wednesday, 2/26/2025","How major US stock indexes fared Wednesday, 2/26/2025",0,GOLD,MARKETAUX
e84d75ae-0260-4096-b5c7-b84c9c341d9b,e84d75ae-0260-4096-b5c7-b84c9c341d9b,IOGEAR Introduces Quantum Thunderbolt™ 5 Dock Pro: A Powerful Dock for Creative Professionals and Hybrid Workers,IOGEAR Introduces Quantum Thunderbolt™ 5 Dock Pro: A Powerful Dock for Creative Professionals and Hybrid Workers,0,GOLD,MARKETAUX
e84d75ae-0260-4096-b5c7-b84c9c341d9b,0242d2b3-b1ad-4240-94a9-b144b8bc8c22,IOGEAR Introduces Quantum Thunderbolt™ 5 Dock Pro: A Powerful Dock for Creative Professionals and Hybrid Workers,IOGEAR Introduces Quantum Thunderbolt™ 5 Dock Pro: A Powerful Dock for Creative Professionals and Hybrid Workers,0,GOLD,MARKETAUX
052f5ea0-4d39-4b25-9da8-5867f65c8ee4,052f5ea0-4d39-4b25-9da8-5867f65c8ee4,"US stock market today: Dow jumps 200 points, S&P nears record, Nasdaq climbs as Trump eyes Fed shake-up and Nvidia leads top movers","US stock market today: Dow jumps 200 points, S&P nears record, Nasdaq climbs as Trump eyes Fed shake-up and Nvidia leads top movers",0,GOLD,MARKETAUX
a0732479-2645-4bcf-ade0-82d09648d3db,a0732479-2645-4bcf-ade0-82d09648d3db,Nvidia-Backed CoreWeave Scales Down US IPO Plans,Nvidia-Backed CoreWeave Scales Down US IPO Plans,0,GOLD,MARKETAUX
1fa9c452-1a46-41e2-b14c-d1b6f4ac9122,1fa9c452-1a46-41e2-b14c-d1b6f4ac9122,Ross Gerber Says Tesla (TSLA) Is ‘Almost Like a Meme Stock’,Ross Gerber Says Tesla (TSLA) Is ‘Almost Like a Meme Stock’,0,GOLD,MARKETAUX
1eb9f288-09ca-4a84-921e-c216849164b3,1eb9f288-09ca-4a84-921e-c216849164b3,US stocks cannot get out of the red today,US stocks cannot get out of the red today,0,GOLD,MARKETAUX
1222810c-6439-4a03-b084-4de6d86731ef,1222810c-6439-4a03-b084-4de6d86731ef,Microchip Technology Appoints Victor Peng to Its Board of Directors,Microchip Technology Appoints Victor Peng to Its Board of Directors,0,GOLD,MARKETAUX
0dc5419a-309f-4d60-b9e1-88cef912db30,0dc5419a-309f-4d60-b9e1-88cef912db30,Stock market starts 2025 with losses,Stock market starts 2025 with losses,0,GOLD,MARKETAUX
8dff9907-fc40-454f-ad27-24206a768e10,8dff9907-fc40-454f-ad27-24206a768e10,Gold: Will American Investors Finally Wake Up to Yellow Metal's Monster Rally?,Gold: Will American Investors Finally Wake Up to Yellow Metal's Monster Rally?,0,GOLD,MARKETAUX
2b8a6921-c25a-4d70-ab12-1bf765219bc5,2b8a6921-c25a-4d70-ab12-1bf765219bc5,Nvidia's Main Threat Isn't DeepSeek But Something Else,Nvidia's Main Threat Isn't DeepSeek But Something Else,0,GOLD,MARKETAUX
7592e144-b61c-4e78-8bbb-672beac48027,7592e144-b61c-4e78-8bbb-672beac48027,Cyngn Announces Strategic Collaboration With NVIDIA Corporation (NVDA),Cyngn Announces Strategic Collaboration With NVIDIA Corporation (NVDA),0,GOLD,MARKETAUX
c44f8572-3277-4020-b3cf-c0d905d9aa0c,c44f8572-3277-4020-b3cf-c0d905d9aa0c,Asia shares firm on hopes for US trade deals,Asia shares firm on hopes for US trade deals,0,GOLD,MARKETAUX
ae11e813-732a-471a-94a0-18957cb49375,ae11e813-732a-471a-94a0-18957cb49375,"US Stock Markets Today: All Three Indices Open Strong, S&P 500 Up 0.4%","US Stock Markets Today: All Three Indices Open Strong, S&P 500 Up 0.4%",0,GOLD,MARKETAUX
fedab87c-7cdb-4d90-84a8-c3e7054970cc,fedab87c-7cdb-4d90-84a8-c3e7054970cc,US stocks mixed at close; Dow Jones drops nearly 100 pts,US stocks mixed at close; Dow Jones drops nearly 100 pts,0,GOLD,MARKETAUX
27f2d481-1873-43e5-954e-851c233dfa11,27f2d481-1873-43e5-954e-851c233dfa11,A Looming Breakout Is Just One Reason To Track This Hot IPO Stock,A Looming Breakout Is Just One Reason To Track This Hot IPO Stock,0,GOLD,MARKETAUX
3e4e21a7-d913-4453-bede-4dcba6ee86ff,3e4e21a7-d913-4453-bede-4dcba6ee86ff,Stock Market Today: Mixed Trading as Tech Gains While Dow Slips in Midday Market Update,Stock Market Today: Mixed Trading as Tech Gains While Dow Slips in Midday Market Update,0,GOLD,MARKETAUX
8187d92e-3b2e-4c6c-988f-8e43b9cfab77,8187d92e-3b2e-4c6c-988f-8e43b9cfab77,It's not just tariffs. 4 other issues are battering stock market sentiment.,It's not just tariffs. 4 other issues are battering stock market sentiment.,0,GOLD,MARKETAUX
b872e50d-bd5f-4dae-bae6-0064783203bc,b872e50d-bd5f-4dae-bae6-0064783203bc,NVIDIA To Surge 20% With Earnings?,NVIDIA To Surge 20% With Earnings?,0,GOLD,MARKETAUX
1f3dc9e9-1f47-4c35-bde5-af44ee89c10d,1f3dc9e9-1f47-4c35-bde5-af44ee89c10d,"US stock market today: Market dips- Dow Jones, S&P 500, and Nasdaq react to tariff tensions; as US-Canada trade war escalates despite inflation cooling","US stock market today: Market dips- Dow Jones, S&P 500, and Nasdaq react to tariff tensions; as US-Canada trade war escalates despite inflation cooling",0,GOLD,MARKETAUX
bf8cfd71-cbda-4866-9f7e-0d9593ccc4a7,bf8cfd71-cbda-4866-9f7e-0d9593ccc4a7,Nvidia Falls 9% As Trump’s Tariffs Rout Stocks,Nvidia Falls 9% As Trump’s Tariffs Rout Stocks,0,GOLD,MARKETAUX
6c2240b0-81f0-4405-9207-90b5f14a6841,6c2240b0-81f0-4405-9207-90b5f14a6841,US Stocks Plunge Amid Rising Inflation and Trade Uncertainty,US Stocks Plunge Amid Rising Inflation and Trade Uncertainty,0,GOLD,MARKETAUX
7df79168-4f64-4913-ad73-aa643b0bec33,7df79168-4f64-4913-ad73-aa643b0bec33,"Stock market today: Nasdaq, S&P 500 eke out gains as Dow, bitcoin drop with all eyes on Nvidia earnings","Stock market today: Nasdaq, S&P 500 eke out gains as Dow, bitcoin drop with all eyes on Nvidia earnings",0,GOLD,MARKETAUX
c769ebcf-e1ac-4f24-a4d1-bdc968c993b9,c769ebcf-e1ac-4f24-a4d1-bdc968c993b9,"Market Recap: S&P 500, Dow, and Nasdaq Retreat as PPI Data Shows Tariff Impact","Market Recap: S&P 500, Dow, and Nasdaq Retreat as PPI Data Shows Tariff Impact",0,GOLD,MARKETAUX
23706c26-f33d-495b-a882-ec6d063936bc,23706c26-f33d-495b-a882-ec6d063936bc,"The Zacks Analyst Blog Highlights Taiwan Semiconductor Manufacturing, NVIDIA, Intuit and S&P Global","The Zacks Analyst Blog Highlights Taiwan Semiconductor Manufacturing, NVIDIA, Intuit and S&P Global",0,GOLD,MARKETAUX
82ac1921-8891-49cd-835e-c79d72eada05,82ac1921-8891-49cd-835e-c79d72eada05,Is NVIDIA Corporation (NVDA) the Best Big Tech Stock to Buy According to Analysts?,Is NVIDIA Corporation (NVDA) the Best Big Tech Stock to Buy According to Analysts?,0,GOLD,MARKETAUX
afa1553d-cd2e-4260-9929-42d1bdc2435b,afa1553d-cd2e-4260-9929-42d1bdc2435b,Silver Lake nears deal for stake in Intel's Altera (INTC:NASDAQ),Silver Lake nears deal for stake in Intel's Altera (INTC:NASDAQ),0,GOLD,MARKETAUX
ad57c277-d43b-440f-898e-d0b6d8ab8b0a,ad57c277-d43b-440f-898e-d0b6d8ab8b0a,Walleye Capital LLC Acquires Shares in Arogo Capital Acquisition Corp,Walleye Capital LLC Acquires Shares in Arogo Capital Acquisition Corp,0,GOLD,MARKETAUX
8843e1ab-48f8-489c-8d39-83fd376a61cc,8843e1ab-48f8-489c-8d39-83fd376a61cc,Equities Stumble As Economic Data Raises Stagflation Fears,Equities Stumble As Economic Data Raises Stagflation Fears,0,GOLD,MARKETAUX
8d84af38-099a-4f24-a71b-18211bd68265,8d84af38-099a-4f24-a71b-18211bd68265,"Futures Rise Ahead Of FOMC, Boosted By Trade War De-escalation, China Stimmies","Futures Rise Ahead Of FOMC, Boosted By Trade War De-escalation, China Stimmies",0,GOLD,MARKETAUX
93211693-6927-4c16-9dc5-87c27e4c190b,93211693-6927-4c16-9dc5-87c27e4c190b,Nvidia Prepares for a Post-China Future With Massive AI Upside Potential,Nvidia Prepares for a Post-China Future With Massive AI Upside Potential,0,GOLD,MARKETAUX
43966bbe-e61d-43dd-8570-c084ed16846c,43966bbe-e61d-43dd-8570-c084ed16846c,Micron Shortens Its Product Cadence To Align With Grace Blackwell (Upgrade) (MU),Micron Shortens Its Product Cadence To Align With Grace Blackwell (Upgrade) (MU),0,GOLD,MARKETAUX
4ed3fd60-340a-465d-b334-233e8ff8a3e6,4ed3fd60-340a-465d-b334-233e8ff8a3e6,AMD to Host Annual Meeting of Stockholders,AMD to Host Annual Meeting of Stockholders,0,GOLD,MARKETAUX
1aa52747-be5e-4419-add8-30aece67702f,1aa52747-be5e-4419-add8-30aece67702f,U.S. Markets Decline; Nasdaq China Golden Dragon Index Gains,U.S. Markets Decline; Nasdaq China Golden Dragon Index Gains,0,GOLD,MARKETAUX
9a8a7637-f066-4efd-95bb-e29a54e0abbe,9a8a7637-f066-4efd-95bb-e29a54e0abbe,Dow drops nearly 650 points on worries about Trump’s latest tariffs,Dow drops nearly 650 points on worries about Trump’s latest tariffs,0,GOLD,MARKETAUX
9da0bdef-9e04-413b-9e58-c50dd4ab734a,9da0bdef-9e04-413b-9e58-c50dd4ab734a,NVIDIA (NVDA) Stock Drops Amid Tariff Concerns and Market Downturn,NVIDIA (NVDA) Stock Drops Amid Tariff Concerns and Market Downturn,0,GOLD,MARKETAUX
87cc58a3-808b-4124-aec1-5b1169da59ee,87cc58a3-808b-4124-aec1-5b1169da59ee,🔒 Stocks navigate a ‘Fog of Uncertainty’ amid rising global risks,🔒 Stocks navigate a ‘Fog of Uncertainty’ amid rising global risks,0,GOLD,MARKETAUX
78f372d0-16c9-4c28-a9f6-149267a52736,78f372d0-16c9-4c28-a9f6-149267a52736,"Zacks Investment Ideas feature highlights: Nasdaq 100 Index ETF, US Oil Fund ETF, Advanced Micro Devices, Tesla and Hims and Hers Health","Zacks Investment Ideas feature highlights: Nasdaq 100 Index ETF, US Oil Fund ETF, Advanced Micro Devices, Tesla and Hims and Hers Health",0,GOLD,MARKETAUX
f8fbc868-a37d-4f67-b7d8-bdad083ad78c,f8fbc868-a37d-4f67-b7d8-bdad083ad78c,Nvidia hits the jackpot following the U.S.-China trade truce; here's why Jensen Huang is smiling all the way,Nvidia hits the jackpot following the U.S.-China trade truce; here's why Jensen Huang is smiling all the way,0,GOLD,MARKETAUX
e35130f3-cbc1-49a0-9e5e-aaf876b02f68,e35130f3-cbc1-49a0-9e5e-aaf876b02f68,Nvidia: What’s Powering The Next AI Era (NASDAQ:NVDA),Nvidia: What’s Powering The Next AI Era (NASDAQ:NVDA),0,GOLD,MARKETAUX
5371fe33-bbb2-4026-b659-a10140e8c56e,5371fe33-bbb2-4026-b659-a10140e8c56e,3 Ways To Profit With Big Tech Back In The Driver’s Seat,3 Ways To Profit With Big Tech Back In The Driver’s Seat,0,GOLD,MARKETAUX
0babb451-7a29-441e-b682-fbb9e5e9c3e7,0babb451-7a29-441e-b682-fbb9e5e9c3e7,"US stock market today: S&P 500 flat, Dow Jones down, Nasdaq‑100 up— biggest gainers, losers as Wall Street eyes US-China trade talks and potential tariff deal","US stock market today: S&P 500 flat, Dow Jones down, Nasdaq‑100 up— biggest gainers, losers as Wall Street eyes US-China trade talks and potential tariff deal",0,GOLD,MARKETAUX
33cd12d3-875d-43dc-a229-4167e2794068,33cd12d3-875d-43dc-a229-4167e2794068,Trump says it's full steam ahead for Canada and Mexico tariffs tomorrow. Now stocks are tanking.,Trump says it's full steam ahead for Canada and Mexico tariffs tomorrow. Now stocks are tanking.,0,GOLD,MARKETAUX
8779b64b-f828-42d5-a140-5e6f09f78d35,e488caed-5484-4eef-abfb-e6f3fdd76d8f,"Advanced Micro Devices, Inc. (AMD) is Attracting Investor Attention: Here is What You Should Know","Advanced Micro Devices, Inc. (AMD) is Attracting Investor Attention: Here is What You Should Know",0,GOLD,MARKETAUX
8779b64b-f828-42d5-a140-5e6f09f78d35,8779b64b-f828-42d5-a140-5e6f09f78d35,"Advanced Micro Devices, Inc. (AMD) is Attracting Investor Attention: Here is What You Should Know","Advanced Micro Devices, Inc. (AMD) is Attracting Investor Attention: Here is What You Should Know",0,GOLD,MARKETAUX
c6628555-e151-4a08-b0d8-7f9dd5f5f1f9,c6628555-e151-4a08-b0d8-7f9dd5f5f1f9,Super Micro shares fall on planned $2 billion convertible debt offering,Super Micro shares fall on planned $2 billion convertible debt offering,0,GOLD,MARKETAUX
e8f10c50-cc08-4c26-993d-0007b38536bc,e8f10c50-cc08-4c26-993d-0007b38536bc,U.S. stock market tumbles the day after Trump’s major tariff announcement,U.S. stock market tumbles the day after Trump’s major tariff announcement,0,GOLD,MARKETAUX
c0397e5e-15ae-4de9-adee-7f8a7cb9fbe4,c0397e5e-15ae-4de9-adee-7f8a7cb9fbe4,"Wall Street veteran analyst Tom Lee, who called the market surge, weighs in on what’s next for the S&P 500","Wall Street veteran analyst Tom Lee, who called the market surge, weighs in on what’s next for the S&P 500",0,GOLD,MARKETAUX
b42dbff0-dc23-46f6-9dd8-2fd08daf0416,b42dbff0-dc23-46f6-9dd8-2fd08daf0416,S&P 500 Gains & Losses Today: Index Extends Gains as Tech Stocks Surge,S&P 500 Gains & Losses Today: Index Extends Gains as Tech Stocks Surge,0,GOLD,MARKETAUX
59e00015-2654-4c25-849e-f5285399a508,59e00015-2654-4c25-849e-f5285399a508,"Supreme Court Decision May Help Unleash $150 Trillion ""American Birthright” Hidden for Over a Century","Supreme Court Decision May Help Unleash $150 Trillion ""American Birthright” Hidden for Over a Century",0,GOLD,MARKETAUX
7a65bc6c-7b72-4b4b-9b3e-16cd23f77048,7a65bc6c-7b72-4b4b-9b3e-16cd23f77048,A. Stotz All Weather Strategies – January 2025,A. Stotz All Weather Strategies – January 2025,0,GOLD,MARKETAUX
c5aef7cf-2a93-4807-b717-09c0fe40e2d8,c5aef7cf-2a93-4807-b717-09c0fe40e2d8,"Dow falls 649 points, S&P, Nasdaq slide on tariff fears","Dow falls 649 points, S&P, Nasdaq slide on tariff fears",0,GOLD,MARKETAUX
1391c91f-39d0-4d95-8418-189e421dfe83,1391c91f-39d0-4d95-8418-189e421dfe83,Canadian General Investments: Investment Update - Unaudited,Canadian General Investments: Investment Update - Unaudited,0,GOLD,MARKETAUX
1391c91f-39d0-4d95-8418-189e421dfe83,5b429833-ce99-4f0f-b7c7-f7fd8325a8b4,Canadian General Investments: Investment Update - Unaudited,Canadian General Investments: Investment Update - Unaudited,0,GOLD,MARKETAUX
1391c91f-39d0-4d95-8418-189e421dfe83,fcea0251-23ba-4c03-8494-3bd7eaa4b03e,Canadian General Investments: Investment Update - Unaudited,Canadian General Investments: Investment Update - Unaudited,0,GOLD,MARKETAUX
1391c91f-39d0-4d95-8418-189e421dfe83,a838ea8c-0d3b-4b94-bfc8-a45074781163,Canadian General Investments: Investment Update - Unaudited,Canadian General Investments: Investment Update - Unaudited,0,GOLD,MARKETAUX
1391c91f-39d0-4d95-8418-189e421dfe83,c03be41e-1680-40c8-9b6b-2db81a043fa8,Canadian General Investments: Investment Update - Unaudited,Canadian General Investments: Investment Update - Unaudited,0,GOLD,MARKETAUX
1391c91f-39d0-4d95-8418-189e421dfe83,21b02155-a5b8-4f67-91c8-9a5f2f9b207d,Canadian General Investments: Investment Update - Unaudited,Canadian General Investments: Investment Update - Unaudited,0,GOLD,MARKETAUX
19e1ec7d-b235-4752-ad30-785c59df85b8,19e1ec7d-b235-4752-ad30-785c59df85b8,"Worried About ""Magnificent Seven"" Volatility in 2025? The Vanguard Mega Cap Value ETF Might Be the Answer.","Worried About ""Magnificent Seven"" Volatility in 2025? The Vanguard Mega Cap Value ETF Might Be the Answer.",0,GOLD,MARKETAUX
e83591f3-9640-4929-9394-a086b99883dc,e83591f3-9640-4929-9394-a086b99883dc,"3 Ultra-Safe Vanguard ETFs to Buy, Even If There's a Stock Market Sell-Off in 2025","3 Ultra-Safe Vanguard ETFs to Buy, Even If There's a Stock Market Sell-Off in 2025",0,GOLD,MARKETAUX
c2ce8e46-5f66-4064-857c-4408f207373d,c2ce8e46-5f66-4064-857c-4408f207373d,"Compared to Estimates, Netflix (NFLX) Q4 Earnings: A Look at Key Metrics","Compared to Estimates, Netflix (NFLX) Q4 Earnings: A Look at Key Metrics",0,GOLD,MARKETAUX
122e8e23-b346-4c0e-9f38-d9dee6b3c2ea,122e8e23-b346-4c0e-9f38-d9dee6b3c2ea,China’s tech stocks enter bull market after DeepSeek breakthrough,China’s tech stocks enter bull market after DeepSeek breakthrough,0,GOLD,MARKETAUX
a2538d88-09c8-4357-bf2d-5ba54f43ae88,a2538d88-09c8-4357-bf2d-5ba54f43ae88,Trading the Trade Disruptions,Trading the Trade Disruptions,0,GOLD,MARKETAUX
9192ea13-65cb-4a93-b6c8-9b1421af51c9,9192ea13-65cb-4a93-b6c8-9b1421af51c9,Why EchoStar Stock Keeps Falling,Why EchoStar Stock Keeps Falling,0,GOLD,MARKETAUX
1b2cb991-b3ed-4515-b7b8-2c5e1a975446,1b2cb991-b3ed-4515-b7b8-2c5e1a975446,NVIDIA Earnings: Can Blackwell Chips Provide Tailwind?,NVIDIA Earnings: Can Blackwell Chips Provide Tailwind?,0,GOLD,MARKETAUX
4134cbc9-b9be-437a-9ecc-2aec44371783,4134cbc9-b9be-437a-9ecc-2aec44371783,Manulife announces Subordinated Debenture issue | MFC Stock News,Manulife announces Subordinated Debenture issue | MFC Stock News,0,GOLD,MARKETAUX
8e747321-6ed4-4d9a-870f-301faa6effde,8e747321-6ed4-4d9a-870f-301faa6effde,U.S. Stocks Seeing Modest Strength Following Two-Day Pullback,U.S. Stocks Seeing Modest Strength Following Two-Day Pullback,0,GOLD,MARKETAUX
1c95321b-5629-4597-ad47-06f30f1e2252,1c95321b-5629-4597-ad47-06f30f1e2252,This 15.6% Dividend Is A Smart ‘Buy The Dip’ Play,This 15.6% Dividend Is A Smart ‘Buy The Dip’ Play,0,GOLD,MARKETAUX
2217659d-1ec1-4df3-932e-bd2e71c5a0c8,2217659d-1ec1-4df3-932e-bd2e71c5a0c8,Carter's (CRI) Reduces Dividend Amid Strategic Shift and Market Pressures,Carter's (CRI) Reduces Dividend Amid Strategic Shift and Market Pressures,0,GOLD,MARKETAUX
fe8f957a-522d-4c49-92ad-309061da0dd5,fe8f957a-522d-4c49-92ad-309061da0dd5,Futures Slide On Latest Batch Of Disappointing Earnings,Futures Slide On Latest Batch Of Disappointing Earnings,0,GOLD,MARKETAUX
2e73a0de-8e00-4a19-a7eb-fe251c77d479,2e73a0de-8e00-4a19-a7eb-fe251c77d479,"Wall Street Stock market hails US-China trade deal: Dow Jones, S&P 500, Nasdaq head towards biggest single-day jumps in months, Nvidia, Tesla share prices jump big","Wall Street Stock market hails US-China trade deal: Dow Jones, S&P 500, Nasdaq head towards biggest single-day jumps in months, Nvidia, Tesla share prices jump big",0,GOLD,MARKETAUX
9b76defd-6c2e-43fb-bd41-939993bf140d,9b76defd-6c2e-43fb-bd41-939993bf140d,Markets Shudder At Trump’s Tariffs: S&P 500 Has Worst Day In 5 Years As Apple Stock Dives 9%,Markets Shudder At Trump’s Tariffs: S&P 500 Has Worst Day In 5 Years As Apple Stock Dives 9%,0,GOLD,MARKETAUX
521c8903-458c-45d6-af56-3c3e862b4846,521c8903-458c-45d6-af56-3c3e862b4846,Tech Stocks Decline as Chinese Equities Shine; NVDA Loses $139 Billion in Value,Tech Stocks Decline as Chinese Equities Shine; NVDA Loses $139 Billion in Value,0,GOLD,MARKETAUX
928f5e2c-0d09-4328-88a9-b912eecb3b73,928f5e2c-0d09-4328-88a9-b912eecb3b73,DLSS vs. FSR vs. XeSS: Analyze & Comparing AI Upscaler. Which One The Best??,DLSS vs. FSR vs. XeSS: Analyze & Comparing AI Upscaler. Which One The Best??,0,GOLD,MARKETAUX
4e6353b3-b0d5-4fb1-8cc5-03ce4ff63212,4e6353b3-b0d5-4fb1-8cc5-03ce4ff63212,"Dow Pops To 5-Week High And Bitcoin Tops $100,000 As Trump Stokes Rally","Dow Pops To 5-Week High And Bitcoin Tops $100,000 As Trump Stokes Rally",0,GOLD,MARKETAUX
aa091ff3-abae-4848-b9d6-924a23df38e8,aa091ff3-abae-4848-b9d6-924a23df38e8,Stock market today: Asian shares are mostly higher after advance on Wall Street,Stock market today: Asian shares are mostly higher after advance on Wall Street,0,GOLD,MARKETAUX
ee8b1e4f-21c5-4a68-9279-ee21098eca19,ee8b1e4f-21c5-4a68-9279-ee21098eca19,XWELL Reports Fiscal Year 2024 Results,XWELL Reports Fiscal Year 2024 Results,0,GOLD,MARKETAUX
918b5c01-6d1a-4678-bb8f-44a7e3edf786,918b5c01-6d1a-4678-bb8f-44a7e3edf786,Why It’s (Almost) Time to Buy This 15.6% Yielder – The Contrary Investing Report,Why It’s (Almost) Time to Buy This 15.6% Yielder – The Contrary Investing Report,0,GOLD,MARKETAUX
9e435aa8-640b-47f0-8992-075eacdbf095,9e435aa8-640b-47f0-8992-075eacdbf095,What to Expect From the Q2 Earnings Reporting Cycle,What to Expect From the Q2 Earnings Reporting Cycle,0,GOLD,MARKETAUX
fa8d36fd-3c53-42ad-af4c-bed54a0848c0,fa8d36fd-3c53-42ad-af4c-bed54a0848c0,"Transocean Ltd. Announces Fourth Quarter, Full Year 2024 Earnings Release Date","Transocean Ltd. Announces Fourth Quarter, Full Year 2024 Earnings Release Date",0,GOLD,MARKETAUX
8d6128a2-11ca-40ca-a6bf-c44e01cf6f88,8d6128a2-11ca-40ca-a6bf-c44e01cf6f88,Jim Cramer Says That NVIDIA “Has Made a Historic Comeback”,Jim Cramer Says That NVIDIA “Has Made a Historic Comeback”,0,GOLD,MARKETAUX
411eef8f-a2e9-4b6f-9f73-c27feebac035,411eef8f-a2e9-4b6f-9f73-c27feebac035,Don't overthink CoreWeave's IPO. It is a bellwether — just not for all of AI.,Don't overthink CoreWeave's IPO. It is a bellwether — just not for all of AI.,0,GOLD,MARKETAUX
4a6328ce-34ed-424f-ba57-f79e4b0585af,4a6328ce-34ed-424f-ba57-f79e4b0585af,Stock market today: Nasdaq leads market rally as investors cheer Fed rate decision,Stock market today: Nasdaq leads market rally as investors cheer Fed rate decision,0,GOLD,MARKETAUX
046db7b0-7146-4dd7-8eab-e5e05e22cbd9,046db7b0-7146-4dd7-8eab-e5e05e22cbd9,Meta sued for allegedly favouring foreign workers over US citizens; case could impact H-1B visa hiring,Meta sued for allegedly favouring foreign workers over US citizens; case could impact H-1B visa hiring,0,GOLD,MARKETAUX
42f9602c-eca4-4300-aa53-83e7751dbd7b,42f9602c-eca4-4300-aa53-83e7751dbd7b,Market Recap: Wall Street Plunges as Trump's Tariffs Trigger Global Selloff,Market Recap: Wall Street Plunges as Trump's Tariffs Trigger Global Selloff,0,GOLD,MARKETAUX
31ee00f7-1436-4430-af8a-b24e26dff7b5,31ee00f7-1436-4430-af8a-b24e26dff7b5,"Restaurant Brands International exec sells shares for $322,247 By Investing.com","Restaurant Brands International exec sells shares for $322,247 By Investing.com",0,GOLD,MARKETAUX
827b0770-ad7c-4118-92e3-91f52a1c2d00,827b0770-ad7c-4118-92e3-91f52a1c2d00,Nvidia Could Burst The AI Bubble Next Week — Expect Poor Guidance (Downgrade) (NVDA),Nvidia Could Burst The AI Bubble Next Week — Expect Poor Guidance (Downgrade) (NVDA),0,GOLD,MARKETAUX
6e09b839-04d2-44c8-b546-4c6028a1b519,6e09b839-04d2-44c8-b546-4c6028a1b519,Bulls vs. Bears: AMD reviewed after Q4 results (AMD:NASDAQ),Bulls vs. Bears: AMD reviewed after Q4 results (AMD:NASDAQ),0,GOLD,MARKETAUX
610c2650-c0e0-4e83-8424-b74f05ce808a,610c2650-c0e0-4e83-8424-b74f05ce808a,Wall Street Futures jump as US-China tariff deal lifts global sentiment,Wall Street Futures jump as US-China tariff deal lifts global sentiment,0,GOLD,MARKETAUX
71a3b6f4-32c6-461e-9794-b6e03e7bdadf,71a3b6f4-32c6-461e-9794-b6e03e7bdadf,NVIDIA Corporation (NVDA): Among the Best Stocks to Buy According to Jim Simons’ Renaissance Technologies,NVIDIA Corporation (NVDA): Among the Best Stocks to Buy According to Jim Simons’ Renaissance Technologies,0,GOLD,MARKETAUX
