a_id,b_id,a_title,b_title,hamming,a_src,b_src
7af60e82-1408-4b46-a81c-87e60039bc64,7af60e82-1408-4b46-a81c-87e60039bc64,These are the 7 things we're watching in the stock market in the week ahead,These are the 7 things we're watching in the stock market in the week ahead,0,GOLD,MARKETAUX
b0971fed-3518-4c3b-a0a8-1d9ecf7780f2,b0971fed-3518-4c3b-a0a8-1d9ecf7780f2,EXL Reports 2024 Fourth Quarter and Year-End Results; Issues 2025 Guidance,EXL Reports 2024 Fourth Quarter and Year-End Results; Issues 2025 Guidance,0,GOLD,MARKETAUX
c03be41e-1680-40c8-9b6b-2db81a043fa8,1391c91f-39d0-4d95-8418-189e421dfe83,Canadian General Investments: Investment Update - Unaudited,Canadian General Investments: Investment Update - Unaudited,0,GOLD,MARKETAUX
c03be41e-1680-40c8-9b6b-2db81a043fa8,5b429833-ce99-4f0f-b7c7-f7fd8325a8b4,Canadian General Investments: Investment Update - Unaudited,Canadian General Investments: Investment Update - Unaudited,0,GOLD,MARKETAUX
c03be41e-1680-40c8-9b6b-2db81a043fa8,fcea0251-23ba-4c03-8494-3bd7eaa4b03e,Canadian General Investments: Investment Update - Unaudited,Canadian General Investments: Investment Update - Unaudited,0,GOLD,MARKETAUX
c03be41e-1680-40c8-9b6b-2db81a043fa8,a838ea8c-0d3b-4b94-bfc8-a45074781163,Canadian General Investments: Investment Update - Unaudited,Canadian General Investments: Investment Update - Unaudited,0,GOLD,MARKETAUX
c03be41e-1680-40c8-9b6b-2db81a043fa8,c03be41e-1680-40c8-9b6b-2db81a043fa8,Canadian General Investments: Investment Update - Unaudited,Canadian General Investments: Investment Update - Unaudited,0,GOLD,MARKETAUX
c03be41e-1680-40c8-9b6b-2db81a043fa8,21b02155-a5b8-4f67-91c8-9a5f2f9b207d,Canadian General Investments: Investment Update - Unaudited,Canadian General Investments: Investment Update - Unaudited,0,GOLD,MARKETAUX
c7054a12-ef9b-4ca7-aa53-e8519160877c,c7054a12-ef9b-4ca7-aa53-e8519160877c,"AI Startup FuriosaAI Reportedly Rejects $800M Meta Platforms, Inc. (META) Buyout Offer","AI Startup FuriosaAI Reportedly Rejects $800M Meta Platforms, Inc. (META) Buyout Offer",0,GOLD,MARKETAUX
ec00cc7e-ae0b-48e1-b982-a3d2cbe82fbf,ec00cc7e-ae0b-48e1-b982-a3d2cbe82fbf,Tesla: A Disastrous Q1 2025 That Brings My Fair Value Way Down (NASDAQ:TSLA),Tesla: A Disastrous Q1 2025 That Brings My Fair Value Way Down (NASDAQ:TSLA),0,GOLD,MARKETAUX
37b49c78-89b6-4dc7-981f-d675f91a6919,37b49c78-89b6-4dc7-981f-d675f91a6919,Boost Your Portfolio with These 3 Attractive US Growth Stocks,Boost Your Portfolio with These 3 Attractive US Growth Stocks,0,GOLD,MARKETAUX
ef573249-32b9-4262-a9a0-a24946152f01,ef573249-32b9-4262-a9a0-a24946152f01,IZEA Launches Dutch Auction Tender Offer to Repurchase Shares | IZEA Stock News,IZEA Launches Dutch Auction Tender Offer to Repurchase Shares | IZEA Stock News,0,GOLD,MARKETAUX
d2c99966-53e7-428c-9c36-7b3afb29d370,d2c99966-53e7-428c-9c36-7b3afb29d370,SoftBank Corp. and Quantinuum Announce Groundbreaking Partnership Toward Practical Application of Quantum Computing,SoftBank Corp. and Quantinuum Announce Groundbreaking Partnership Toward Practical Application of Quantum Computing,0,GOLD,MARKETAUX
20c786c4-3938-49a5-b709-093c849a69e7,20c786c4-3938-49a5-b709-093c849a69e7,Twilio (TWLO) Stock Dips While Market Gains: Key Facts,Twilio (TWLO) Stock Dips While Market Gains: Key Facts,0,GOLD,MARKETAUX
63d9741d-2ebc-43d0-87f0-de570c1f8549,63d9741d-2ebc-43d0-87f0-de570c1f8549,Stocks Plummet As Recession Fears Mount Amid Tariff Concerns—TTI Goes Negative,Stocks Plummet As Recession Fears Mount Amid Tariff Concerns—TTI Goes Negative,0,GOLD,MARKETAUX
1e28a8ae-bf81-4ad2-872d-4bc2a815f499,1e28a8ae-bf81-4ad2-872d-4bc2a815f499,deepSeek shakes up U.S. tech market,deepSeek shakes up U.S. tech market,0,GOLD,MARKETAUX
480ab1dd-b00e-42d5-b21a-dc2c8a85db35,480ab1dd-b00e-42d5-b21a-dc2c8a85db35,Nvidia Q4 Earnings Preview: A Make-or-Break Moment for the AI Trade?,Nvidia Q4 Earnings Preview: A Make-or-Break Moment for the AI Trade?,0,GOLD,MARKETAUX
aef61bbb-bf2c-47b3-a3eb-3b5b89a2c992,aef61bbb-bf2c-47b3-a3eb-3b5b89a2c992,"Apple Inc (AAPL), Alphabet Inc (GOOG) Have to Prove Themselves, CNBC Reporter Says","Apple Inc (AAPL), Alphabet Inc (GOOG) Have to Prove Themselves, CNBC Reporter Says",0,GOLD,MARKETAUX
100192fe-e9bb-4bd2-9849-914180f2a05d,100192fe-e9bb-4bd2-9849-914180f2a05d,"David Tepper's Appaloosa Revamps Portfolio, Cuts Down On Semiconductor Stocks - Advanced Micro Devices (NASDAQ:AMD), Amazon.com (NASDAQ:AMZN)","David Tepper's Appaloosa Revamps Portfolio, Cuts Down On Semiconductor Stocks - Advanced Micro Devices (NASDAQ:AMD), Amazon.com (NASDAQ:AMZN)",0,GOLD,MARKETAUX
77e69f77-7080-44b7-93e5-136f010633e4,77e69f77-7080-44b7-93e5-136f010633e4,Futures Push Higher Into Record Territory Amid Trade Talk Progress,Futures Push Higher Into Record Territory Amid Trade Talk Progress,0,GOLD,MARKETAUX
8e5ae411-0c77-4abc-b012-7e74b724472d,8e5ae411-0c77-4abc-b012-7e74b724472d,Brown Advisory Inc Reduces Stake in Phreesia Inc by 31.90%,Brown Advisory Inc Reduces Stake in Phreesia Inc by 31.90%,0,GOLD,MARKETAUX
68653929-bf0e-4071-8450-c6a63e399d43,68653929-bf0e-4071-8450-c6a63e399d43,XPeng Inc. Sponsored ADR (XPEV) Stock Moves -0.15%: What You Should Know,XPeng Inc. Sponsored ADR (XPEV) Stock Moves -0.15%: What You Should Know,0,GOLD,MARKETAUX
ce71ce6c-aa9f-4e87-9e47-cee2b2b8506f,ce71ce6c-aa9f-4e87-9e47-cee2b2b8506f,eBay Inc. (EBAY): A Bull Case Theory,eBay Inc. (EBAY): A Bull Case Theory,0,GOLD,MARKETAUX
eb594fcf-8ff2-4c0f-a591-f1456f50d7b4,eb594fcf-8ff2-4c0f-a591-f1456f50d7b4,"Kura Sushi USA, Inc. (KRUS) Q2 2025 Earnings Call Transcript","Kura Sushi USA, Inc. (KRUS) Q2 2025 Earnings Call Transcript",0,GOLD,MARKETAUX
239895f0-a687-4366-b2b2-f71758424e78,239895f0-a687-4366-b2b2-f71758424e78,Dick's Sporting Goods (DKS) Stock Moves -1.09%: What You Should Know,Dick's Sporting Goods (DKS) Stock Moves -1.09%: What You Should Know,0,GOLD,MARKETAUX
966f83b0-c8e3-4838-bfa8-7778fb365c3d,966f83b0-c8e3-4838-bfa8-7778fb365c3d,Investors Who Bought Trump's 'Pro Growth' Agenda Now Pay for It,Investors Who Bought Trump's 'Pro Growth' Agenda Now Pay for It,0,GOLD,MARKETAUX
6b664bce-9f95-47f3-a373-b18f3725bc9e,6b664bce-9f95-47f3-a373-b18f3725bc9e,Tariff Tussle: Musk Slams Navarro as Markets Attempt a Dead Cat Bounce,Tariff Tussle: Musk Slams Navarro as Markets Attempt a Dead Cat Bounce,0,GOLD,MARKETAUX
53d53a53-0579-4f97-8f03-5ca2757dbdd3,53d53a53-0579-4f97-8f03-5ca2757dbdd3,Microsoft-OpenAI Rift May Cap Stock Upside Potential,Microsoft-OpenAI Rift May Cap Stock Upside Potential,0,GOLD,MARKETAUX
6f2c3662-0e98-4476-b42c-c5c85740c743,6f2c3662-0e98-4476-b42c-c5c85740c743,MPLX LP (MPLX) Beats Stock Market Upswing: What Investors Need to Know,MPLX LP (MPLX) Beats Stock Market Upswing: What Investors Need to Know,0,GOLD,MARKETAUX
d2e494f1-05ed-4937-a93f-76d515a7aa9a,d2e494f1-05ed-4937-a93f-76d515a7aa9a,MPLX LP (MPLX) Gains But Lags Market: What You Should Know,MPLX LP (MPLX) Gains But Lags Market: What You Should Know,0,GOLD,MARKETAUX
6aa22690-0a8d-44ca-be60-935d7c932774,6aa22690-0a8d-44ca-be60-935d7c932774,Phillips 66 to Participate in J.P. Morgan 2025 Energy Conference | PSX stock news,Phillips 66 to Participate in J.P. Morgan 2025 Energy Conference | PSX stock news,0,GOLD,MARKETAUX
f067b24a-3c84-4685-8e26-f6e515c57406,f067b24a-3c84-4685-8e26-f6e515c57406,MPLX LP (MPLX) Sees a More Significant Dip Than Broader Market: Some Facts to Know,MPLX LP (MPLX) Sees a More Significant Dip Than Broader Market: Some Facts to Know,0,GOLD,MARKETAUX
9556e275-4f89-451d-b781-f65396f17b36,9556e275-4f89-451d-b781-f65396f17b36,US Tariffs Prompt Criticism at Houston Energy Industry Gathering,US Tariffs Prompt Criticism at Houston Energy Industry Gathering,0,GOLD,MARKETAUX
92ddd2ad-cf23-40a0-ab8d-889e68d9c9e7,92ddd2ad-cf23-40a0-ab8d-889e68d9c9e7,Peyto Reports Strong Fourth Quarter and 2024 Annual Results,Peyto Reports Strong Fourth Quarter and 2024 Annual Results,0,GOLD,MARKETAUX
87980b0c-1c7c-4723-be97-5826deda26e9,87980b0c-1c7c-4723-be97-5826deda26e9,Flushing Financial (FFIC) Misses Q4 Earnings Estimates,Flushing Financial (FFIC) Misses Q4 Earnings Estimates,0,GOLD,MARKETAUX
2cfaeceb-a47b-4d60-a340-c5d328c92388,2cfaeceb-a47b-4d60-a340-c5d328c92388,S&P 500 hits record high after $10 trillion rally,S&P 500 hits record high after $10 trillion rally,0,GOLD,MARKETAUX
bdc40ac9-8da7-4fdb-9644-c5bece3293e4,bdc40ac9-8da7-4fdb-9644-c5bece3293e4,FMX Futures Faces Delays for Treasury Product Launch Amid Clearing House Issues,FMX Futures Faces Delays for Treasury Product Launch Amid Clearing House Issues,0,GOLD,MARKETAUX
523ff206-2ecc-4c99-b2ff-70fa929718f7,523ff206-2ecc-4c99-b2ff-70fa929718f7,Fed's Hammack says sentiment data about the economy has been concerning,Fed's Hammack says sentiment data about the economy has been concerning,0,GOLD,MARKETAUX
c4e6efc6-fbfe-4ab5-a633-19c73705365a,c4e6efc6-fbfe-4ab5-a633-19c73705365a,Jamie Dimon bemoans 'grossly unfair' Wells Fargo asset cap,Jamie Dimon bemoans 'grossly unfair' Wells Fargo asset cap,0,GOLD,MARKETAUX
bcc5ad58-5968-484e-b918-fe43861611e6,bcc5ad58-5968-484e-b918-fe43861611e6,Willis Towers Watson Public Limited Company (WTW) Launches AI-Powered Expert Assistant to Streamline HR and Benefits Management,Willis Towers Watson Public Limited Company (WTW) Launches AI-Powered Expert Assistant to Streamline HR and Benefits Management,0,GOLD,MARKETAUX
03cf5df0-3501-413a-bee1-64c1234c6be9,03cf5df0-3501-413a-bee1-64c1234c6be9,"Capital One Financial Corporation (COF) Presents at Morgan Stanley US Financials, Payments & CRE Conference Transcript","Capital One Financial Corporation (COF) Presents at Morgan Stanley US Financials, Payments & CRE Conference Transcript",0,GOLD,MARKETAUX
0aa24364-b739-4890-bfab-9df7b5a324d2,0aa24364-b739-4890-bfab-9df7b5a324d2,Bristol-Myers Squibb Company (BMY) Presents at 45th Annual TD Cowen Health Care Conference (Transcript),Bristol-Myers Squibb Company (BMY) Presents at 45th Annual TD Cowen Health Care Conference (Transcript),0,GOLD,MARKETAUX
929df2d1-9aa1-4e4b-b3db-709222524b5e,929df2d1-9aa1-4e4b-b3db-709222524b5e,Accelerate Diagnostics (AXDX) Appoints New Directors and Forms Strategic Committee | AXDX Stock News,Accelerate Diagnostics (AXDX) Appoints New Directors and Forms Strategic Committee | AXDX Stock News,0,GOLD,MARKETAUX
f5c0679c-f91a-43de-89cf-d4ccf3fe0dcd,f5c0679c-f91a-43de-89cf-d4ccf3fe0dcd,Market Today: Nvidia and Google Make Waves with AI Developments,Market Today: Nvidia and Google Make Waves with AI Developments,0,GOLD,MARKETAUX
d50990a5-dc6d-421d-a596-01d9940c7a05,d50990a5-dc6d-421d-a596-01d9940c7a05,"Insider Sell: Richard Daly Sells 70,000 Shares of Catalyst Pharmaceuticals Inc (CPRX)","Insider Sell: Richard Daly Sells 70,000 Shares of Catalyst Pharmaceuticals Inc (CPRX)",0,GOLD,MARKETAUX
9ca8504b-ee32-49a4-9090-b232f25e2cae,9ca8504b-ee32-49a4-9090-b232f25e2cae,The Sun Never Sets On This Cheap 6% Dividend – The Contrary Investing Report,The Sun Never Sets On This Cheap 6% Dividend – The Contrary Investing Report,0,GOLD,MARKETAUX
99ca4f82-c769-4787-a731-36b8a87972a2,99ca4f82-c769-4787-a731-36b8a87972a2,"Compared to Estimates, OrthoPediatrics (KIDS) Q4 Earnings: A Look at Key Metrics","Compared to Estimates, OrthoPediatrics (KIDS) Q4 Earnings: A Look at Key Metrics",0,GOLD,MARKETAUX
41c955d6-ce4c-45b6-9f62-701f9716f2a4,41c955d6-ce4c-45b6-9f62-701f9716f2a4,"SI-BONE, Inc.: Small-cap Developer Of Medical Implants And A Steady Revenue Grower (SIBN)","SI-BONE, Inc.: Small-cap Developer Of Medical Implants And A Steady Revenue Grower (SIBN)",0,GOLD,MARKETAUX
a8ccaf86-43b9-40ac-9711-4aad7d6ee493,a8ccaf86-43b9-40ac-9711-4aad7d6ee493,AeroVironment (AVAV) Stock Moves -0.42%: What You Should Know,AeroVironment (AVAV) Stock Moves -0.42%: What You Should Know,0,GOLD,MARKETAUX
419c6d45-93ac-4978-9a8c-8713e1c8e6cb,419c6d45-93ac-4978-9a8c-8713e1c8e6cb,"The Greenbrier Companies, Inc. (GBX) Q3 2025 Earnings Call Transcript","The Greenbrier Companies, Inc. (GBX) Q3 2025 Earnings Call Transcript",0,GOLD,MARKETAUX
8c6fceb9-0914-40c1-8f5c-08871e6794cb,8c6fceb9-0914-40c1-8f5c-08871e6794cb,AeroVironment (AVAV) Stock Sinks As Market Gains: What You Should Know,AeroVironment (AVAV) Stock Sinks As Market Gains: What You Should Know,0,GOLD,MARKETAUX
493f4bbb-711a-47a9-bad4-91dfe9300593,493f4bbb-711a-47a9-bad4-91dfe9300593,"Pitney Bowes (PBI) Set to Announce Q1 Earnings, Analysts Expect EPS Turnaround","Pitney Bowes (PBI) Set to Announce Q1 Earnings, Analysts Expect EPS Turnaround",0,GOLD,MARKETAUX
ecb256e4-d0cc-4093-94a4-bed8b74fe4ce,ecb256e4-d0cc-4093-94a4-bed8b74fe4ce,IBC Advanced Alloys Announces Amendment of Existing Credit Facilities | IAALF Stock News,IBC Advanced Alloys Announces Amendment of Existing Credit Facilities | IAALF Stock News,0,GOLD,MARKETAUX
6a154cb2-dba7-45d3-ac41-6d47628502ae,6a154cb2-dba7-45d3-ac41-6d47628502ae,"1 Stock to Buy, 1 Stock to Sell This Week: AMD, Constellation Brands","1 Stock to Buy, 1 Stock to Sell This Week: AMD, Constellation Brands",0,GOLD,MARKETAUX
d7d73516-f1a3-4239-9de1-4d0ccccac882,d7d73516-f1a3-4239-9de1-4d0ccccac882,Cramer's Lightning Round: Papa John's is a 'wait and see situation',Cramer's Lightning Round: Papa John's is a 'wait and see situation',0,GOLD,MARKETAUX
cd30ca44-1227-4b53-8004-bc1f779b724d,cd30ca44-1227-4b53-8004-bc1f779b724d,TWO Announces Pricing of Public Offering of Senior Notes | TWO Stock News,TWO Announces Pricing of Public Offering of Senior Notes | TWO Stock News,0,GOLD,MARKETAUX
497015aa-bf24-44c7-8d5e-f7292343762e,497015aa-bf24-44c7-8d5e-f7292343762e,Headlines of Interest to Holders of Preferred Stock and Baby Bonds,Headlines of Interest to Holders of Preferred Stock and Baby Bonds,0,GOLD,MARKETAUX
1b1091e1-bf73-4637-bca5-ad83330bf4c3,1b1091e1-bf73-4637-bca5-ad83330bf4c3,TPG RE Finance Trust (TRTX) Q4 Earnings and Revenues Miss Estimates,TPG RE Finance Trust (TRTX) Q4 Earnings and Revenues Miss Estimates,0,GOLD,MARKETAUX
19f9e812-d8a3-41e3-ac87-602ac9e6b989,19f9e812-d8a3-41e3-ac87-602ac9e6b989,Four Corners Property Trust (FCPT) Acquires Olive Garden Location for $4.1 Million,Four Corners Property Trust (FCPT) Acquires Olive Garden Location for $4.1 Million,0,GOLD,MARKETAUX
f4bfec1a-b5a5-4b46-8cf3-d44f5da56434,f4bfec1a-b5a5-4b46-8cf3-d44f5da56434,Acadia Realty Trust (AKR) Lags Q4 FFO and Revenue Estimates,Acadia Realty Trust (AKR) Lags Q4 FFO and Revenue Estimates,0,GOLD,MARKETAUX
e8261fca-89a7-4b2e-95bf-9e1968bcd733,e8261fca-89a7-4b2e-95bf-9e1968bcd733,"HG Vora Files Definitive Proxy Materials and Sends Letter to PENN Entertainment, Inc. Shareholders","HG Vora Files Definitive Proxy Materials and Sends Letter to PENN Entertainment, Inc. Shareholders",0,GOLD,MARKETAUX
087a852d-95a4-4cb3-9007-ff4681836cfa,087a852d-95a4-4cb3-9007-ff4681836cfa,"ROSEN, SKILLED INVESTOR COUNSEL, Encourages DoubleVerify Holdings, Inc. Investors to Secure Counsel Before Important Deadline in Securities Class Action -- DV","ROSEN, SKILLED INVESTOR COUNSEL, Encourages DoubleVerify Holdings, Inc. Investors to Secure Counsel Before Important Deadline in Securities Class Action -- DV",0,GOLD,MARKETAUX
a1c4e491-1ea0-4f78-9070-2fecb3d94aa1,af41eaf0-4b83-48ea-9354-b84258fdbfa4,"INVESTOR ALERT: Pomerantz Law Firm Reminds Investors with Losses on their Investment in DoubleVerify Holdings, Inc. of Class Action Lawsuit and Upcoming Deadlines - DV","INVESTOR ALERT: Pomerantz Law Firm Reminds Investors with Losses on their Investment in DoubleVerify Holdings, Inc.of Class Action Lawsuit and Upcoming Deadlines - DV",0,GOLD,MARKETAUX
a1c4e491-1ea0-4f78-9070-2fecb3d94aa1,fa8cf154-bba4-4f22-a0a4-72ce1903c096,"INVESTOR ALERT: Pomerantz Law Firm Reminds Investors with Losses on their Investment in DoubleVerify Holdings, Inc. of Class Action Lawsuit and Upcoming Deadlines - DV","INVESTOR ALERT: Pomerantz Law Firm Reminds Investors with Losses on their Investment in DoubleVerify Holdings, Inc. of Class Action Lawsuit and Upcoming Deadlines - DV",0,GOLD,MARKETAUX
a1c4e491-1ea0-4f78-9070-2fecb3d94aa1,a1c4e491-1ea0-4f78-9070-2fecb3d94aa1,"INVESTOR ALERT: Pomerantz Law Firm Reminds Investors with Losses on their Investment in DoubleVerify Holdings, Inc. of Class Action Lawsuit and Upcoming Deadlines - DV","INVESTOR ALERT: Pomerantz Law Firm Reminds Investors with Losses on their Investment in DoubleVerify Holdings, Inc. of Class Action Lawsuit and Upcoming Deadlines - DV",0,GOLD,MARKETAUX
a1c4e491-1ea0-4f78-9070-2fecb3d94aa1,5d29b888-0dc3-4976-9fc7-3a9de86e1c06,"INVESTOR ALERT: Pomerantz Law Firm Reminds Investors with Losses on their Investment in DoubleVerify Holdings, Inc. of Class Action Lawsuit and Upcoming Deadlines - DV","INVESTOR ALERT: Pomerantz Law Firm Reminds Investors with Losses on their Investment in DoubleVerify Holdings, Inc. of Class Action Lawsuit and Upcoming Deadlines - DV",0,GOLD,MARKETAUX
fd5fcb9a-981f-4fb8-a5cf-27c497c36d59,fd5fcb9a-981f-4fb8-a5cf-27c497c36d59,Is DoubleVerify Holdings Inc. (DV) the Best Affordable Tech Stock to Buy According to Analysts?,Is DoubleVerify Holdings Inc. (DV) the Best Affordable Tech Stock to Buy According to Analysts?,0,GOLD,MARKETAUX
6a967d96-12e8-4dda-ae97-8ecc8cf58c3e,6a967d96-12e8-4dda-ae97-8ecc8cf58c3e,"Law Offices of Frank R. Cruz Encourages DoubleVerify Holdings, Inc. (DV) Investors To Inquire About Securities Fraud Class Action","Law Offices of Frank R. Cruz Encourages DoubleVerify Holdings, Inc. (DV) Investors To Inquire About Securities Fraud Class Action",0,GOLD,MARKETAUX
3122df6e-ea85-49d9-b953-def318e49226,3122df6e-ea85-49d9-b953-def318e49226,DoubleVerify Holdings (DV) Receives Buy Rating from Needham | DV Stock News,DoubleVerify Holdings (DV) Receives Buy Rating from Needham | DV Stock News,0,GOLD,MARKETAUX
72cd8d6f-e95f-448f-bdf3-a0e13d531d7c,72cd8d6f-e95f-448f-bdf3-a0e13d531d7c,Southwest Gas (SWX) Adjusts First Quarter Earnings Announcement Date | SWX Stock News,Southwest Gas (SWX) Adjusts First Quarter Earnings Announcement Date | SWX Stock News,0,GOLD,MARKETAUX
5cd169da-07f3-4bbb-a418-21ddd2eba5e8,5cd169da-07f3-4bbb-a418-21ddd2eba5e8,This Is What Whales Are Betting On NextEra Energy - NextEra Energy (NYSE:NEE),This Is What Whales Are Betting On NextEra Energy - NextEra Energy (NYSE:NEE),0,GOLD,MARKETAUX
c449e24f-9af8-46d3-8d67-7dc6e21b2a30,c449e24f-9af8-46d3-8d67-7dc6e21b2a30,"ROSEN, LEADING TRIAL ATTORNEYS, Encourages Edison International Investors to Secure Counsel Before Important Deadline in Securities Class Action First Filed by the Firm -- EIX","ROSEN, LEADING TRIAL ATTORNEYS, Encourages Edison International Investors to Secure Counsel Before Important Deadline in Securities Class Action First Filed by the Firm -- EIX",0,GOLD,MARKETAUX
696e1b86-46d4-47c6-8b3a-a224909e5e6e,696e1b86-46d4-47c6-8b3a-a224909e5e6e,10 Best Dividend Stocks to Buy for Dependable Dividend Growth,10 Best Dividend Stocks to Buy for Dependable Dividend Growth,0,GOLD,MARKETAUX
f44e6f07-1605-40d9-9b14-2d3af0911e34,f44e6f07-1605-40d9-9b14-2d3af0911e34,Eversource Energy (ES) Tops Q4 Earnings and Revenue Estimates,Eversource Energy (ES) Tops Q4 Earnings and Revenue Estimates,0,GOLD,MARKETAUX
f6ebaaaa-91aa-4986-b640-06ad5aa2540f,f6ebaaaa-91aa-4986-b640-06ad5aa2540f,New Fortress Energy (NFE) Delays 10-Q Filing Amid Jamaica Sale,New Fortress Energy (NFE) Delays 10-Q Filing Amid Jamaica Sale,0,GOLD,MARKETAUX
58f8cd35-be08-43a8-997d-64facbd41ab2,58f8cd35-be08-43a8-997d-64facbd41ab2,20250617 - Nebius Just Posted 700% ARR Growth -- But Can It Survive the GPU Price War?,20250617 - Nebius Just Posted 700% ARR Growth -- But Can It Survive the GPU Price War?,0,GOLD,MARKETAUX
75b714f5-2db1-4fc9-b180-c407c3fa0955,75b714f5-2db1-4fc9-b180-c407c3fa0955,Nvidia And The Super Bowl Of AI (undefined:NVDA),Nvidia And The Super Bowl Of AI (undefined:NVDA),0,GOLD,MARKETAUX
f7ac8582-75ee-4acd-9cad-de561b259dd1,f7ac8582-75ee-4acd-9cad-de561b259dd1,Apple Hardware Executive Says iPhone Maker Plans To Use AI For Speeding Up Custom Chip Design: 'High Potential In Getting More Design Work In Less Time',Apple Hardware Executive Says iPhone Maker Plans To Use AI For Speeding Up Custom Chip Design: 'High Potential In Getting More Design Work In Less Time',0,GOLD,MARKETAUX
f853ce76-aeaf-4a86-b764-851c5574907c,f853ce76-aeaf-4a86-b764-851c5574907c,"Futures, Global Markets Jump On Trump Trade Deal With UK","Futures, Global Markets Jump On Trump Trade Deal With UK",0,GOLD,MARKETAUX
c7a5c852-8f8f-48f7-9c51-520b09add56e,c7a5c852-8f8f-48f7-9c51-520b09add56e,"Amazon, Microsoft, Alphabet, and Meta Just Gave Nvidia Great News. But Does That Make The Stock A Buy Before Feb. 26?","Amazon, Microsoft, Alphabet, and Meta Just Gave Nvidia Great News. But Does That Make The Stock A Buy Before Feb. 26?",0,GOLD,MARKETAUX
79d886ed-da4c-4231-b6f3-9f8e08928dca,79d886ed-da4c-4231-b6f3-9f8e08928dca,Hewlett Packard Enterprise Company (HPE): Among Overlooked Tech Stocks to Buy Now,Hewlett Packard Enterprise Company (HPE): Among Overlooked Tech Stocks to Buy Now,0,GOLD,MARKETAUX
a17ed989-e600-4e70-b9ed-7bcd4d5f7b1d,a17ed989-e600-4e70-b9ed-7bcd4d5f7b1d,2 Cybersecurity Stocks You Can Buy and Hold for the Next Decade,2 Cybersecurity Stocks You Can Buy and Hold for the Next Decade,0,GOLD,MARKETAUX
b5be9231-11c4-4439-ac86-fb0e231a3742,b5be9231-11c4-4439-ac86-fb0e231a3742,Is Nvidia a Buy?,Is Nvidia a Buy?,0,GOLD,MARKETAUX
e46575e0-91c8-403d-8c42-b5401200180d,e46575e0-91c8-403d-8c42-b5401200180d,Wall Street dips as Middle East tensions rise,Wall Street dips as Middle East tensions rise,0,GOLD,MARKETAUX
d23ba652-8429-45ba-a9a9-2b4ac568aa5e,d23ba652-8429-45ba-a9a9-2b4ac568aa5e,5 Fidelity Stock Funds For Your 401(k),5 Fidelity Stock Funds For Your 401(k),0,GOLD,MARKETAUX
b7bffa1a-2fae-4fba-907a-c4238e87f734,b7bffa1a-2fae-4fba-907a-c4238e87f734,The US session is underway. Yields little changed. Stocks are higher.,The US session is underway. Yields little changed. Stocks are higher.,0,GOLD,MARKETAUX
a19c73af-e28c-42a1-a314-2beb26f0cb98,a19c73af-e28c-42a1-a314-2beb26f0cb98,Nvidia is headlining CES; here are 5 chip stocks rated higher (NASDAQ:NVDA),Nvidia is headlining CES; here are 5 chip stocks rated higher (NASDAQ:NVDA),0,GOLD,MARKETAUX
0c36c3cc-ffbb-4210-82c7-0e5926dc56e5,0c36c3cc-ffbb-4210-82c7-0e5926dc56e5,Supermicro Stock Drops as Server Maker Lowers Its Revenue Outlook,Supermicro Stock Drops as Server Maker Lowers Its Revenue Outlook,0,GOLD,MARKETAUX
a4b7491c-f213-43cb-a87c-13124816fc1e,a4b7491c-f213-43cb-a87c-13124816fc1e,Nvidia’s AI dominance remains intact despite challenges from DeepSeek,Nvidia’s AI dominance remains intact despite challenges from DeepSeek,0,GOLD,MARKETAUX
b49fae47-8a1c-44cf-9356-88ba4b0e038a,b49fae47-8a1c-44cf-9356-88ba4b0e038a,Stock Market Today: S&P 500 Approaches Record High as Middle East Tensions Ease,Stock Market Today: S&P 500 Approaches Record High as Middle East Tensions Ease,0,GOLD,MARKETAUX
76a9e98d-3808-4ba0-a50b-f1a0bbd13e64,76a9e98d-3808-4ba0-a50b-f1a0bbd13e64,Zacks Industry Outlook Highlights NVIDIA and Texas Instruments,Zacks Industry Outlook Highlights NVIDIA and Texas Instruments,0,GOLD,MARKETAUX
4fe048b9-7267-4d95-afc7-5c00f73609cc,4fe048b9-7267-4d95-afc7-5c00f73609cc,Trump’s Microcap Renaissance,Trump’s Microcap Renaissance,0,GOLD,MARKETAUX
dca50edc-2a0a-4cbf-9865-8fc85bdba151,dca50edc-2a0a-4cbf-9865-8fc85bdba151,Is IONQ Stock the Next NVIDIA and Worth Buying Now?,Is IONQ Stock the Next NVIDIA and Worth Buying Now?,0,GOLD,MARKETAUX
5c5873df-6d40-44b5-8f37-250bdda17a3b,5c5873df-6d40-44b5-8f37-250bdda17a3b,Nvidia (NVDA) Directors Sell Shares Amidst Insider Activity,Nvidia (NVDA) Directors Sell Shares Amidst Insider Activity,0,GOLD,MARKETAUX
4b138157-672c-4a0f-bf9c-d9165cd15912,4b138157-672c-4a0f-bf9c-d9165cd15912,"Nvidia CEO Jensen Huang Warns US Lawmakers Are Fueling Rise Of China's Huawei With Their Chip Export Bans - NVIDIA (NASDAQ:NVDA), Amazon.com (NASDAQ:AMZN)","Nvidia CEO Jensen Huang Warns US Lawmakers Are Fueling Rise Of China's Huawei With Their Chip Export Bans - NVIDIA (NASDAQ:NVDA), Amazon.com (NASDAQ:AMZN)",0,GOLD,MARKETAUX
12afaf03-529a-4d5d-82b4-bd9dee415673,12afaf03-529a-4d5d-82b4-bd9dee415673,Why the tech trade has more room to run even as the Nasdaq 100 hovers at all-time highs,Why the tech trade has more room to run even as the Nasdaq 100 hovers at all-time highs,0,GOLD,MARKETAUX
c1182a21-2937-4835-a747-cf02e9f0dcf9,c1182a21-2937-4835-a747-cf02e9f0dcf9,"Up 17% in 2025, Has Warren Buffett-Led Berkshire Hathaway Run Up Too Far, Too Fast?","Up 17% in 2025, Has Warren Buffett-Led Berkshire Hathaway Run Up Too Far, Too Fast?",0,GOLD,MARKETAUX
78cb4500-e380-4aae-977d-4cef64c8c042,78cb4500-e380-4aae-977d-4cef64c8c042,"Nvidia: Selloff Overdone, Huawei 910D Can’t Compete (NASDAQ:NVDA)","Nvidia: Selloff Overdone, Huawei 910D Can’t Compete (NASDAQ:NVDA)",0,GOLD,MARKETAUX
f7ce5237-7db4-43ae-b93f-96b8a18a02f8,f7ce5237-7db4-43ae-b93f-96b8a18a02f8,Legal AI startup Luminance raises $75 million,Legal AI startup Luminance raises $75 million,0,GOLD,MARKETAUX
4e2bdeba-6602-4a2a-8c19-ae8f7399b9ff,4e2bdeba-6602-4a2a-8c19-ae8f7399b9ff,Black Coffee: Market Mayhem,Black Coffee: Market Mayhem,0,GOLD,MARKETAUX
4e7381eb-2311-4c45-9126-4f5c6a1a93f5,4e7381eb-2311-4c45-9126-4f5c6a1a93f5,Intel SVP outlines Israel's place on production roadmap,Intel SVP outlines Israel's place on production roadmap,0,GOLD,MARKETAUX
fb1eb992-c2a4-415d-9632-7b9f360aa4ee,fb1eb992-c2a4-415d-9632-7b9f360aa4ee,"Stocks, Yields, Dollar Soar On US-China Trade War Truce","Stocks, Yields, Dollar Soar On US-China Trade War Truce",0,GOLD,MARKETAUX
c4385df2-826b-4ba4-989a-a8a763bf1f75,c4385df2-826b-4ba4-989a-a8a763bf1f75,"The Best And Worst Performing Assets Of The ""March Meltdown"" And ""Queezy Q1""","The Best And Worst Performing Assets Of The ""March Meltdown"" And ""Queezy Q1""",0,GOLD,MARKETAUX
51b0d133-9d65-402c-8d02-e99081732da7,51b0d133-9d65-402c-8d02-e99081732da7,3 US Artificial Intelligence Growth Stocks That Can Power Your Portfolio Higher,3 US Artificial Intelligence Growth Stocks That Can Power Your Portfolio Higher,0,GOLD,MARKETAUX
