a_id,b_id,a_title,b_title,hamming,a_src,b_src
9063aa29-5ade-439c-b241-51bc8d6adc53,9063aa29-5ade-439c-b241-51bc8d6adc53,"Yerbaé Partners with National Foodservice Provider, Guckenheimer","Yerbaé Partners with National Foodservice Provider, Guckenheimer",0,GOLD,MARKETAUX
7f4b4382-2bc0-440b-af18-43b3022aee67,7f4b4382-2bc0-440b-af18-43b3022aee67,Camden National Corporation (CAC) Q4 2024 Earnings Call Transcript,Camden National Corporation (CAC) Q4 2024 Earnings Call Transcript,0,GOLD,MARKETAUX
01253f79-5bfc-47f7-a4e0-76df41d5859d,01253f79-5bfc-47f7-a4e0-76df41d5859d,"Grupo Aeroportuario del Pacífico, S.A.B. de C.V. (PAC): A Bull Case Theory","Grupo Aeroportuario del Pacífico, S.A.B. de C.V. (PAC): A Bull Case Theory",0,GOLD,MARKETAUX
5f0afc5b-b593-4885-81b0-1d8f213547ab,5f0afc5b-b593-4885-81b0-1d8f213547ab,RioCan Real Estate Investment Trust Announces April 2025 Distribution,RioCan Real Estate Investment Trust Announces April 2025 Distribution,0,GOLD,MARKETAUX
04b7174b-323a-4663-a621-0c32b18a1596,04b7174b-323a-4663-a621-0c32b18a1596,Les actions et le dollar bondissent après la baisse des tarifs douaniers entre les États-Unis et la Chine,Les actions et le dollar bondissent après la baisse des tarifs douaniers entre les États-Unis et la Chine,0,GOLD,MARKETAUX
90ded1d5-0dee-4918-abb4-a2640928a750,90ded1d5-0dee-4918-abb4-a2640928a750,"Les actions européennes plongent alors que le marasme mondial entre dans sa deuxième semaine, la Bourse US proche du krach","Les actions européennes plongent alors que le marasme mondial entre dans sa deuxième semaine, la Bourse US proche du krach",0,GOLD,MARKETAUX
740e7f60-50df-44b7-a7ea-5327879db58d,740e7f60-50df-44b7-a7ea-5327879db58d,Nvidia's Generative AI To Fuel Hyper-Scalable 3D Rendering For L'Oréal,Nvidia's Generative AI To Fuel Hyper-Scalable 3D Rendering For L'Oréal,0,GOLD,MARKETAUX
7c58c6af-afb9-4456-9a40-e5e411f9a1e6,7c58c6af-afb9-4456-9a40-e5e411f9a1e6,Les actions mondiales rebondissent dans un contexte de tensions entre les États-Unis et le reste du monde,Les actions mondiales rebondissent dans un contexte de tensions entre les États-Unis et le reste du monde,0,GOLD,MARKETAUX
d5d83865-dd0f-434f-9f69-e584a2eec29f,d5d83865-dd0f-434f-9f69-e584a2eec29f,Destiny Media Technologies Inc. (DSNY) Q1 2025 Earnings Call Transcript,Destiny Media Technologies Inc. (DSNY) Q1 2025 Earnings Call Transcript,0,GOLD,MARKETAUX
51009a5c-58d2-46ad-a56f-c50fd1c580a4,51009a5c-58d2-46ad-a56f-c50fd1c580a4,Stingray Reports Fourth Quarter and Full-Year Results for Fiscal 2025,Stingray Reports Fourth Quarter and Full-Year Results for Fiscal 2025,0,GOLD,MARKETAUX
7b4dda2f-8b20-4d5d-bc8b-a4e6ae3ff07d,7b4dda2f-8b20-4d5d-bc8b-a4e6ae3ff07d,"Sorry American firms, the AI trade has moved to China","Sorry American firms, the AI trade has moved to China",0,GOLD,MARKETAUX
39a9789a-541a-4033-8caf-11671bb8ca82,39a9789a-541a-4033-8caf-11671bb8ca82,Stocks fall amid inflation and Trump tariffs,Stocks fall amid inflation and Trump tariffs,0,GOLD,MARKETAUX
5d6fbde2-c80b-4406-947a-2be9ad400bda,5d6fbde2-c80b-4406-947a-2be9ad400bda,Quantum Stocks: Potential Winners and Losers in 2025,Quantum Stocks: Potential Winners and Losers in 2025,0,GOLD,MARKETAUX
d5d8a262-3f5c-4d36-a45d-b5fe11bdc4e4,d5d8a262-3f5c-4d36-a45d-b5fe11bdc4e4,How AI Is Pushing This Non-Technology Stock Higher,How AI Is Pushing This Non-Technology Stock Higher,0,GOLD,MARKETAUX
7d23c802-1307-4536-b2c8-57214ed86887,7d23c802-1307-4536-b2c8-57214ed86887,Hydreight Technologies Provides Update to Financing,Hydreight Technologies Provides Update to Financing,0,GOLD,MARKETAUX
7d23c802-1307-4536-b2c8-57214ed86887,c8f462c4-4b9a-44b4-9de6-1fade78dcbef,Hydreight Technologies Provides Update to Financing,Hydreight Technologies Provides Update to Financing,0,GOLD,MARKETAUX
83e2463e-8384-40cc-83ac-0ba894ee9731,83e2463e-8384-40cc-83ac-0ba894ee9731,Stocks plummet amid fears of recession,Stocks plummet amid fears of recession,0,GOLD,MARKETAUX
ceda9be0-bb39-4a15-aaf5-f04feb75e3f7,ceda9be0-bb39-4a15-aaf5-f04feb75e3f7,"Market Today: IBM and NVIDIA Collaborate on AI, Alphabet Acquires Wiz for $32B","Market Today: IBM and NVIDIA Collaborate on AI, Alphabet Acquires Wiz for $32B",0,GOLD,MARKETAUX
1a27e7d1-5b19-48e3-9eef-f36e2037773d,1a27e7d1-5b19-48e3-9eef-f36e2037773d,Insightful Webinar with GOGO Executives Explores Company Prospects | GOGO Stock News,Insightful Webinar with GOGO Executives Explores Company Prospects | GOGO Stock News,0,GOLD,MARKETAUX
3063d4c9-5238-46cc-8f49-9cec0de92fd2,3063d4c9-5238-46cc-8f49-9cec0de92fd2,Five Below: The Timing To Invest Should Come Soon (NASDAQ:FIVE),Five Below: The Timing To Invest Should Come Soon (NASDAQ:FIVE),0,GOLD,MARKETAUX
dc717fb4-a176-4631-810a-8509737e0758,dc717fb4-a176-4631-810a-8509737e0758,WW International (WW) Files for Bankruptcy Amid Financial Struggles,WW International (WW) Files for Bankruptcy Amid Financial Struggles,0,GOLD,MARKETAUX
bb686dbc-f3a0-440b-97d9-8a5dea2753fc,bb686dbc-f3a0-440b-97d9-8a5dea2753fc,"Stock market today: Dow, S&P 500, Nasdaq futures slip as key inflation print looms and US-China plan falls flat","Stock market today: Dow, S&P 500, Nasdaq futures slip as key inflation print looms and US-China plan falls flat",0,GOLD,MARKETAUX
dea503ee-1220-4139-9f16-3e20d4bd2be7,dea503ee-1220-4139-9f16-3e20d4bd2be7,Joby Aviation Inks $250M,Joby Aviation Inks $250M,0,GOLD,MARKETAUX
07879ce7-130c-44b9-b857-fadb16c78b57,07879ce7-130c-44b9-b857-fadb16c78b57,SEC sues Elon Musk over Twitter stake disclosure By Investing.com,SEC sues Elon Musk over Twitter stake disclosure By Investing.com,0,GOLD,MARKETAUX
8759b759-58cb-4467-98a6-f88b0114a8e3,8759b759-58cb-4467-98a6-f88b0114a8e3,"Stock market today: Dow, S&P 500, Nasdaq futures slide as investors brace for Trump's tariff bazooka","Stock market today: Dow, S&P 500, Nasdaq futures slide as investors brace for Trump's tariff bazooka",0,GOLD,MARKETAUX
81e3280f-9cc5-4c59-ba9f-15425991bc78,81e3280f-9cc5-4c59-ba9f-15425991bc78,"Science Applications Posts Better-Than-Expected Earnings, Joins Qifu Technology, Baidu, American Eagle And Other Big Stocks Moving Higher On Monday - Alpha Technology Group (NASDAQ:ATGL), American Eag","Science Applications Posts Better-Than-Expected Earnings, Joins Qifu Technology, Baidu, American Eagle And Other Big Stocks Moving Higher On Monday - Alpha Technology Group (NASDAQ:ATGL), American Eag",0,GOLD,MARKETAUX
6964f0c7-b7ae-458a-9cc8-e5e5bfafc75a,6964f0c7-b7ae-458a-9cc8-e5e5bfafc75a,Lennar (LEN) Beats Stock Market Upswing: What Investors Need to Know,Lennar (LEN) Beats Stock Market Upswing: What Investors Need to Know,0,GOLD,MARKETAUX
fcc9e94f-dbae-42df-936b-296f6da987bf,fcc9e94f-dbae-42df-936b-296f6da987bf,"Major Tech Stocks Plummet, SMCI Drops Nearly 16%","Major Tech Stocks Plummet, SMCI Drops Nearly 16%",0,GOLD,MARKETAUX
2a35658c-86cb-40cd-b923-bdc3c68b1124,2a35658c-86cb-40cd-b923-bdc3c68b1124,"Here Are The Highest Paid CEOs In 2024: Where Did Elon Musk, Warren Buffett Rank? - Coherent (NYSE:COHR)","Here Are The Highest Paid CEOs In 2024: Where Did Elon Musk, Warren Buffett Rank? - Coherent (NYSE:COHR)",0,GOLD,MARKETAUX
6dd22d20-8312-43dd-b785-f7a9d4dda83c,6dd22d20-8312-43dd-b785-f7a9d4dda83c,Schlumberger: There Are Better Choices In The Oil And Gas Industry,Schlumberger: There Are Better Choices In The Oil And Gas Industry,0,GOLD,MARKETAUX
72fb5f9f-7364-4593-bda0-511a948fa9e5,72fb5f9f-7364-4593-bda0-511a948fa9e5,"Kayne Anderson Energy Infrastructure Fund Provides Unaudited Balance Sheet Information and Announces Its Net Asset Value and Asset Coverage Ratios as of June 30, 2025","Kayne Anderson Energy Infrastructure Fund Provides Unaudited Balance Sheet Information and Announces Its Net Asset Value and Asset Coverage Ratios as of June 30, 2025",0,GOLD,MARKETAUX
d245f56e-39f0-4aaf-a7bd-c69b2f214828,d245f56e-39f0-4aaf-a7bd-c69b2f214828,USA Compression Partners Announces 2024 K-3 Tax Package Availability | USAC Stock News,USA Compression Partners Announces 2024 K-3 Tax Package Availability | USAC Stock News,0,GOLD,MARKETAUX
fd8daafa-9d73-4f30-b568-607123bc099e,fd8daafa-9d73-4f30-b568-607123bc099e,ExxonMobil to Release First Quarter 2025 Financial Results | XOM Stock News,ExxonMobil to Release First Quarter 2025 Financial Results | XOM Stock News,0,GOLD,MARKETAUX
2ce08712-599f-456c-960d-61a9e8d1976e,2ce08712-599f-456c-960d-61a9e8d1976e,Share buyback program of up to USD 1.2 billion,Share buyback program of up to USD 1.2 billion,0,GOLD,MARKETAUX
188d6ad1-c4c1-4b61-b1f8-c7dfde534881,188d6ad1-c4c1-4b61-b1f8-c7dfde534881,"Delek US Holdings, Inc. Announces Quarterly Dividend | DK Stock News","Delek US Holdings, Inc. Announces Quarterly Dividend | DK Stock News",0,GOLD,MARKETAUX
8da7c6d4-d686-46ea-a92c-f3f8b9924baf,8da7c6d4-d686-46ea-a92c-f3f8b9924baf,"KKR, Partners Group to lead Darwinbox funding round","KKR, Partners Group to lead Darwinbox funding round",0,GOLD,MARKETAUX
d47e8162-085f-4776-bc7d-740b3f5ae587,d47e8162-085f-4776-bc7d-740b3f5ae587,"Trump says working on taking Fannie Mae and Freddie Mac public, implicit guarantees remain","Trump says working on taking Fannie Mae and Freddie Mac public, implicit guarantees remain",0,GOLD,MARKETAUX
6f17629b-aa16-47f4-9d61-6b18aa96f6dd,6f17629b-aa16-47f4-9d61-6b18aa96f6dd,"Currency Exchange International, Corp. Announces Strategic Decision to Discontinue Operations of its Subsidiary, Exchange Bank of Canada, Pursue Referral Agreements with Appropriate Parties, and Seek","Currency Exchange International, Corp. Announces Strategic Decision to Discontinue Operations of its Subsidiary, Exchange Bank of Canada, Pursue Referral Agreements with Appropriate Parties, and Seek",0,GOLD,MARKETAUX
7c15dee0-931b-47ba-8a8f-f053cc57e1e6,7c15dee0-931b-47ba-8a8f-f053cc57e1e6,First Horizon Bank Named Official and Exclusive Bank of the Valspar Championship,First Horizon Bank Named Official and Exclusive Bank of the Valspar Championship,0,GOLD,MARKETAUX
39923fa6-7cdd-4bc4-9e6c-938d7b573c38,39923fa6-7cdd-4bc4-9e6c-938d7b573c38,RBB Bancorp to Report Second Quarter 2025 Financial Results,RBB Bancorp to Report Second Quarter 2025 Financial Results,0,GOLD,MARKETAUX
93fb5d53-4867-4739-8277-2004fbacef3b,93fb5d53-4867-4739-8277-2004fbacef3b,"Auburn National Bancorporation, Inc. Declares Quarterly Dividend | AUBN Stock News","Auburn National Bancorporation, Inc. Declares Quarterly Dividend | AUBN Stock News",0,GOLD,MARKETAUX
ee129160-72b8-4435-8121-f6fcb22e5274,ee129160-72b8-4435-8121-f6fcb22e5274,Hancock Whitney Corporation (HWC) Q1 2025 Earnings Call Transcript,Hancock Whitney Corporation (HWC) Q1 2025 Earnings Call Transcript,0,GOLD,MARKETAUX
c1ab9914-e583-4518-b33a-008455a61c18,c1ab9914-e583-4518-b33a-008455a61c18,Ars pharmaceuticals director Laura Shawver sells $555k in stock By Investing.com,Ars pharmaceuticals director Laura Shawver sells $555k in stock By Investing.com,0,GOLD,MARKETAUX
5e1a997e-c381-4bfb-8e7d-f2e62826fed7,5e1a997e-c381-4bfb-8e7d-f2e62826fed7,Futures Rise Ahead Of Record $5.9 Trillion Triple-Witching OpEx,Futures Rise Ahead Of Record $5.9 Trillion Triple-Witching OpEx,0,GOLD,MARKETAUX
66102ad6-ec5d-40f8-9e87-5002ed8fbea9,66102ad6-ec5d-40f8-9e87-5002ed8fbea9,"Crude Oil Gains Over 1%; Walgreens Posts Upbeat Earnings - Altimmune (NASDAQ:ALT), Ascent Solar Technologies (NASDAQ:ASTI)","Crude Oil Gains Over 1%; Walgreens Posts Upbeat Earnings - Altimmune (NASDAQ:ALT), Ascent Solar Technologies (NASDAQ:ASTI)",0,GOLD,MARKETAUX
c124309a-fadd-4ec7-ac8c-77518c07a4e4,c124309a-fadd-4ec7-ac8c-77518c07a4e4,"Exelixis, Inc. 2024 Q4 - Results - Earnings Call Presentation (NASDAQ:EXEL)","Exelixis, Inc. 2024 Q4 - Results - Earnings Call Presentation (NASDAQ:EXEL)",0,GOLD,MARKETAUX
d068e5b0-7e7f-41f2-a288-18f45289a443,d068e5b0-7e7f-41f2-a288-18f45289a443,5 Attractive US Software-as-a-Service Companies That Promise Continued Growth,5 Attractive US Software-as-a-Service Companies That Promise Continued Growth,0,GOLD,MARKETAUX
84f76dbd-0bfa-4342-8bb5-5357fcf7655a,84f76dbd-0bfa-4342-8bb5-5357fcf7655a,"Voyager Therapeutics, Inc. (VYGR) Q4 2024 Earnings Call Transcript","Voyager Therapeutics, Inc. (VYGR) Q4 2024 Earnings Call Transcript",0,GOLD,MARKETAUX
a822dc94-89e8-4c8f-9f2f-69ccadac05ab,a822dc94-89e8-4c8f-9f2f-69ccadac05ab,Thermo Fisher Scientific Inc. (TMO) BofA Securities 2025 Healthcare Conference (Transcript),Thermo Fisher Scientific Inc. (TMO) BofA Securities 2025 Healthcare Conference (Transcript),0,GOLD,MARKETAUX
5a5969cc-0ae0-4aa4-9080-3ec8a0579b4f,5a5969cc-0ae0-4aa4-9080-3ec8a0579b4f,Futures Gain Ahead Of US-China Trade Talks,Futures Gain Ahead Of US-China Trade Talks,0,GOLD,MARKETAUX
7ec8e47f-9e95-4bea-8ad2-9dcfc0193a2f,7ec8e47f-9e95-4bea-8ad2-9dcfc0193a2f,Verisk Analytics (VRSK): Among the Best Consulting Stocks to Buy According to Hedge Funds,Verisk Analytics (VRSK): Among the Best Consulting Stocks to Buy According to Hedge Funds,0,GOLD,MARKETAUX
0464fe84-88c5-4446-929c-4ce01ee8e98f,0464fe84-88c5-4446-929c-4ce01ee8e98f,SOUTHWEST AIRLINES DECLARES 185th QUARTERLY DIVIDEND | LUV Stock News,SOUTHWEST AIRLINES DECLARES 185th QUARTERLY DIVIDEND | LUV Stock News,0,GOLD,MARKETAUX
2a5d16f2-1d81-41e2-ad8f-a601827ff83e,2a5d16f2-1d81-41e2-ad8f-a601827ff83e,First Advantage Corp (FA) Announces Participation in Wolfe Research FinTech Forum,First Advantage Corp (FA) Announces Participation in Wolfe Research FinTech Forum,0,GOLD,MARKETAUX
bf4dd9b8-7c11-4339-a5ae-6d4d9237498b,bf4dd9b8-7c11-4339-a5ae-6d4d9237498b,Carlisle Companies Incorporated 2024 Q4 - Results - Earnings Call Presentation (NYSE:CSL),Carlisle Companies Incorporated 2024 Q4 - Results - Earnings Call Presentation (NYSE:CSL),0,GOLD,MARKETAUX
7c5f99ef-86af-4268-bbde-c775390449c4,7c5f99ef-86af-4268-bbde-c775390449c4,"The Greenbrier Companies, Inc. 2025 Q3 - Results - Earnings Call Presentation (NYSE:GBX)","The Greenbrier Companies, Inc. 2025 Q3 - Results - Earnings Call Presentation (NYSE:GBX)",0,GOLD,MARKETAUX
43c6e072-99cb-4783-814b-e74333b97aba,43c6e072-99cb-4783-814b-e74333b97aba,2 big things to watch this week as the S&P 500 looks to extend its historic win streak,2 big things to watch this week as the S&P 500 looks to extend its historic win streak,0,GOLD,MARKETAUX
9162cd1a-eb0e-4f5a-90f2-f73307380c09,9162cd1a-eb0e-4f5a-90f2-f73307380c09,Ricoh awarded EcoVadis Platinum Rating for Sustainability Performance,Ricoh awarded EcoVadis Platinum Rating for Sustainability Performance,0,GOLD,MARKETAUX
cd592b83-d58a-4e04-b017-27c0bc74bfd4,cd592b83-d58a-4e04-b017-27c0bc74bfd4,STAG Industrial: A Good Play On Reshoring (NYSE:STAG),STAG Industrial: A Good Play On Reshoring (NYSE:STAG),0,GOLD,MARKETAUX
dda31092-855d-445c-af18-a27c638cb0b3,dda31092-855d-445c-af18-a27c638cb0b3,Realty Income Corp. (O) Stock Moves -1.28%: What You Should Know,Realty Income Corp. (O) Stock Moves -1.28%: What You Should Know,0,GOLD,MARKETAUX
a93de1ee-51fc-4f95-9e1d-2a01f2bf9234,a93de1ee-51fc-4f95-9e1d-2a01f2bf9234,CoreCivic (CXW) to Acquire Farmville Detention Center for $67M | CXW Stock News,CoreCivic (CXW) to Acquire Farmville Detention Center for $67M | CXW Stock News,0,GOLD,MARKETAUX
f235f150-b2a0-4eea-9215-4d709bab5510,f235f150-b2a0-4eea-9215-4d709bab5510,VICI Properties Inc. (VICI) Advances While Market Declines: Some Information for Investors,VICI Properties Inc. (VICI) Advances While Market Declines: Some Information for Investors,0,GOLD,MARKETAUX
e2264836-506a-4df4-858f-f8e7c6a4eb8e,e2264836-506a-4df4-858f-f8e7c6a4eb8e,Top 10 Stocks to Buy According to Durable Capital Partners,Top 10 Stocks to Buy According to Durable Capital Partners,0,GOLD,MARKETAUX
4077c956-e44a-4c37-8029-4b0d1d2083d5,4077c956-e44a-4c37-8029-4b0d1d2083d5,Headlines of Interest for Holders of Preferred Stock and Baby Bonds,Headlines of Interest for Holders of Preferred Stock and Baby Bonds,0,GOLD,MARKETAUX
c8ae0ead-5a84-4cd6-9aa8-fc7895a245f6,c8ae0ead-5a84-4cd6-9aa8-fc7895a245f6,RMD share price: why investors like healthcare shares,RMD share price: why investors like healthcare shares,0,GOLD,MARKETAUX
c8ae0ead-5a84-4cd6-9aa8-fc7895a245f6,3362b4f1-4766-4fa8-88c1-6bafb58f0afe,RMD share price: why investors like healthcare shares,RMD share price: why investors like healthcare shares,0,GOLD,MARKETAUX
c8ae0ead-5a84-4cd6-9aa8-fc7895a245f6,f18d171c-daa0-4d46-b52f-d845a5ad74d7,RMD share price: why investors like healthcare shares,RMD share price: why investors like healthcare shares,0,GOLD,MARKETAUX
381881ff-e6b1-48f9-a320-c6c939f95587,381881ff-e6b1-48f9-a320-c6c939f95587,"Shareholders that lost money on DoubleVerify Holdings, Inc.(DV) should contact The Gross Law Firm about pending Class Action - DV","Shareholders that lost money on DoubleVerify Holdings, Inc.(DV) should contact The Gross Law Firm about pending Class Action - DV",0,GOLD,MARKETAUX
112e0c69-ec94-42b8-ae46-2a659bddfb4f,112e0c69-ec94-42b8-ae46-2a659bddfb4f,I’m watching the CAR share price in 2025,I’m watching the CAR share price in 2025,0,GOLD,MARKETAUX
aad03b0f-e156-4661-b24f-8bad25dbd543,2631a6ee-969e-4b75-9dcc-9a0a0e50abca,MIN and Resmed CDI: 2 ASX shares to dig into,MIN and Resmed CDI: 2 ASX shares to dig into,0,GOLD,MARKETAUX
aad03b0f-e156-4661-b24f-8bad25dbd543,aad03b0f-e156-4661-b24f-8bad25dbd543,MIN and Resmed CDI: 2 ASX shares to dig into,MIN and Resmed CDI: 2 ASX shares to dig into,0,GOLD,MARKETAUX
15eca5de-1f18-4da8-8472-07010908db05,15eca5de-1f18-4da8-8472-07010908db05,"DV Stock Alert: DoubleVerify Holdings, Inc. Shareholders With Large Losses Should Contact Robbins LLP for Information on Leading the Class Action Lawsuit","DV Stock Alert: DoubleVerify Holdings, Inc. Shareholders With Large Losses Should Contact Robbins LLP for Information on Leading the Class Action Lawsuit",0,GOLD,MARKETAUX
4ea6ef4f-17ab-49ca-ab1e-88472e1c75fa,4ea6ef4f-17ab-49ca-ab1e-88472e1c75fa,"Carnival Posts Better-Than-Expected Earnings, Joins Liminatus Pharma, Coinbase Global, Uber And Other Big Stocks Moving Higher On Tuesday - Ambarella (NASDAQ:AMBA), Amylyx Pharmaceuticals (NASDAQ:AMLX","Carnival Posts Better-Than-Expected Earnings, Joins Liminatus Pharma, Coinbase Global, Uber And Other Big Stocks Moving Higher On Tuesday - Ambarella (NASDAQ:AMBA), Amylyx Pharmaceuticals (NASDAQ:AMLX",0,GOLD,MARKETAUX
502475e3-c118-4b5f-b4b2-1d5c75631a42,502475e3-c118-4b5f-b4b2-1d5c75631a42,ALLETE Inc (ALE) Recognized for Gender Parity in Corporate Leadership | ALE stock news,ALLETE Inc (ALE) Recognized for Gender Parity in Corporate Leadership | ALE stock news,0,GOLD,MARKETAUX
f5c44b78-e6ce-4454-9fd0-807e0434c978,f5c44b78-e6ce-4454-9fd0-807e0434c978,NextEra Energy (NEE) CEO Highlights Renewable Energy Need Amid Challenges,NextEra Energy (NEE) CEO Highlights Renewable Energy Need Amid Challenges,0,GOLD,MARKETAUX
2066fd54-a01b-41ab-bb94-b4d65ba443d6,2066fd54-a01b-41ab-bb94-b4d65ba443d6,Chip Rossi Appointed to Artesian Resources Board of Directors,Chip Rossi Appointed to Artesian Resources Board of Directors,0,GOLD,MARKETAUX
13c2a30b-98bb-4f4f-bcd0-543b5c0bbc33,13c2a30b-98bb-4f4f-bcd0-543b5c0bbc33,"FLNC INVESTOR ALERT: Fluence Energy, Inc. Investors with Substantial Losses Have Opportunity to Lead the Fluence Class Action Lawsuit","FLNC INVESTOR ALERT: Fluence Energy, Inc. Investors with Substantial Losses Have Opportunity to Lead the Fluence Class Action Lawsuit",0,GOLD,MARKETAUX
bafd93ff-f47e-4b96-ba5e-a3a8aff608fe,bafd93ff-f47e-4b96-ba5e-a3a8aff608fe,NiSource Declares Common Stock Dividend,NiSource Declares Common Stock Dividend,0,GOLD,MARKETAUX
c5bc6c0d-68a5-4b52-8fd8-2c1ca802d2c0,c5bc6c0d-68a5-4b52-8fd8-2c1ca802d2c0,Palantir now among 10 most valuable U.S. tech companies — its earnings multiple is astronomical,Palantir now among 10 most valuable U.S. tech companies — its earnings multiple is astronomical,0,GOLD,MARKETAUX
db6fd31a-7165-49e4-9f21-51e793df4af5,db6fd31a-7165-49e4-9f21-51e793df4af5,Intel (INTC) Climbs Amid Market Turbulence,Intel (INTC) Climbs Amid Market Turbulence,0,GOLD,MARKETAUX
7a800c7b-0d7a-431a-9287-bdde2125f5ea,7a800c7b-0d7a-431a-9287-bdde2125f5ea,The future of Canadian tech runs through Waterloo,The future of Canadian tech runs through Waterloo,0,GOLD,MARKETAUX
e06a5ec0-d2eb-4a0c-8f70-69320e347d65,e06a5ec0-d2eb-4a0c-8f70-69320e347d65,"Quantum Computing Stocks Climb as Rigetti, IonQ Tapped for Department of Defense Program","Quantum Computing Stocks Climb as Rigetti, IonQ Tapped for Department of Defense Program",0,GOLD,MARKETAUX
5e6cd957-328d-4c1c-b6a4-aa2e4f508980,5e6cd957-328d-4c1c-b6a4-aa2e4f508980,"Benzinga Bulls And Bears: Nvidia, Palantir, Marvell Technology — And Markets Rallied In May","Benzinga Bulls And Bears: Nvidia, Palantir, Marvell Technology — And Markets Rallied In May",0,GOLD,MARKETAUX
7b96061e-d052-48be-b2a2-17fe6fba0135,7b96061e-d052-48be-b2a2-17fe6fba0135,Intel’s Decline: A Cautionary Tale For Technology Investors,Intel’s Decline: A Cautionary Tale For Technology Investors,0,GOLD,MARKETAUX
d5bf0260-e6dd-4036-9e72-0be815019f27,d5bf0260-e6dd-4036-9e72-0be815019f27,Futures Flat as Fed Focus Overtakes Middle East Tensions,Futures Flat as Fed Focus Overtakes Middle East Tensions,0,GOLD,MARKETAUX
4d7075b0-01c1-4f25-bb6a-24a125e7eb0c,4d7075b0-01c1-4f25-bb6a-24a125e7eb0c,US equity close: Not a pretty picture as tariff fears weigh,US equity close: Not a pretty picture as tariff fears weigh,0,GOLD,MARKETAUX
4429228a-f58a-43ab-847b-b3592407fa13,4429228a-f58a-43ab-847b-b3592407fa13,"Gold Outshines Tech Stocks And Bitcoin, As Bulls And Bears Battle Ahead Of Trump Tariff Announcement","Gold Outshines Tech Stocks And Bitcoin, As Bulls And Bears Battle Ahead Of Trump Tariff Announcement",0,GOLD,MARKETAUX
e187ee88-e194-47d8-a86b-78838c1c00f1,e187ee88-e194-47d8-a86b-78838c1c00f1,Nvidia Just Got Its First Sell Rating From Wall Street -- Should Investors Be Worried?,Nvidia Just Got Its First Sell Rating From Wall Street -- Should Investors Be Worried?,0,GOLD,MARKETAUX
7d744b3a-2532-45cc-8e03-52ca7a9ee6a3,7d744b3a-2532-45cc-8e03-52ca7a9ee6a3,Futures Drop As Momentum Massacre Crushes Bitcoin,Futures Drop As Momentum Massacre Crushes Bitcoin,0,GOLD,MARKETAUX
91cb063b-d115-4d3f-9da2-d919d9aa5bb6,91cb063b-d115-4d3f-9da2-d919d9aa5bb6,"S&P 500 turns green for 2025 — plus, Microsoft cuts jobs and Disney rises again","S&P 500 turns green for 2025 — plus, Microsoft cuts jobs and Disney rises again",0,GOLD,MARKETAUX
2cc1fe4f-e493-460b-9685-63074e467df2,2cc1fe4f-e493-460b-9685-63074e467df2,"Market Recap: S&P 500 Slips as Tech Stocks Falter, Economic Data and Earnings in Focus","Market Recap: S&P 500 Slips as Tech Stocks Falter, Economic Data and Earnings in Focus",0,GOLD,MARKETAUX
018e57c7-458f-4dbf-abc9-7c9c206e0b9f,018e57c7-458f-4dbf-abc9-7c9c206e0b9f,4 Top Dividend Stocks to Buy in January,4 Top Dividend Stocks to Buy in January,0,GOLD,MARKETAUX
71e7f007-9559-431d-be38-f0dfaa5890ae,71e7f007-9559-431d-be38-f0dfaa5890ae,Advanced Micro Devices Inc (AMD) Trading 3.93% Higher on Jan 3,Advanced Micro Devices Inc (AMD) Trading 3.93% Higher on Jan 3,0,GOLD,MARKETAUX
a6231a37-7d1b-489c-8f85-cb081aa0aac3,a6231a37-7d1b-489c-8f85-cb081aa0aac3,"UAE Pledges $1.4 Trillion Investment In US Tech, Energy, And Manufacturing: Trump And Sheikh Tahnoon Strengthen Strategic Ties - BlackRock (NYSE:BLK), Microsoft (NASDAQ:MSFT)","UAE Pledges $1.4 Trillion Investment In US Tech, Energy, And Manufacturing: Trump And Sheikh Tahnoon Strengthen Strategic Ties - BlackRock (NYSE:BLK), Microsoft (NASDAQ:MSFT)",0,GOLD,MARKETAUX
3641bdbe-14cd-4e21-8fc7-d4b663436732,3641bdbe-14cd-4e21-8fc7-d4b663436732,Why Reddit Stock Is Plummeting Today,Why Reddit Stock Is Plummeting Today,0,GOLD,MARKETAUX
f719ecb1-5879-44ff-866c-d70aacc7a1e7,f719ecb1-5879-44ff-866c-d70aacc7a1e7,"SMCI stock price: Super Micro Computer shares swing wildly on earnings, surge 12% on likely delisting dodge and strong 2026 forecast","SMCI stock price: Super Micro Computer shares swing wildly on earnings, surge 12% on likely delisting dodge and strong 2026 forecast",0,GOLD,MARKETAUX
1afc7a75-f6dd-4692-8825-22cda8b39592,1afc7a75-f6dd-4692-8825-22cda8b39592,"US stock market futures steady as Dow, S&P 500, Nasdaq hover near record highs amid Fed rate cut hopes and Middle East ceasefire stability","US stock market futures steady as Dow, S&P 500, Nasdaq hover near record highs amid Fed rate cut hopes and Middle East ceasefire stability",0,GOLD,MARKETAUX
4d327d8f-2186-4e20-96ee-1ace20054c22,4d327d8f-2186-4e20-96ee-1ace20054c22,"UGREEN Showcases the New AI-Powered NASync iDX Series at NAB Show 2025, Transforming Data Management for Content Creators","UGREEN Showcases the New AI-Powered NASync iDX Series at NAB Show 2025, Transforming Data Management for Content Creators",0,GOLD,MARKETAUX
7fcba54a-0c96-45b4-bba0-e2cf1f66243a,7fcba54a-0c96-45b4-bba0-e2cf1f66243a,SEALSQ NASDAQ QUANTUM DAY: Industry Expert Discussions on the Path to Technology Sovereignty in the U.S.,SEALSQ NASDAQ QUANTUM DAY: Industry Expert Discussions on the Path to Technology Sovereignty in the U.S.,0,GOLD,MARKETAUX
00197c93-6efa-492f-8483-78fdf28d95e7,00197c93-6efa-492f-8483-78fdf28d95e7,Is Palantir Stock Set to Soar Again in the New Year?,Is Palantir Stock Set to Soar Again in the New Year?,0,GOLD,MARKETAUX
7d9fa330-c7e1-47ea-9ac7-b37e29353336,7d9fa330-c7e1-47ea-9ac7-b37e29353336,US stocks close higher; Dow Jones erases most of year-to-date losses,US stocks close higher; Dow Jones erases most of year-to-date losses,0,GOLD,MARKETAUX
fa94a308-1a7a-4d88-b542-21a8854c41d6,fa94a308-1a7a-4d88-b542-21a8854c41d6,Chinese AI startup DeepSeek hit by cyberattack,Chinese AI startup DeepSeek hit by cyberattack,0,GOLD,MARKETAUX
edd13a43-a6a2-469b-8da5-119b294793d9,edd13a43-a6a2-469b-8da5-119b294793d9,Better Artificial Intelligence (AI) Stock: CoreWeave vs. Nvidia,Better Artificial Intelligence (AI) Stock: CoreWeave vs. Nvidia,0,GOLD,MARKETAUX
