a_id,b_id,a_title,b_title,hamming,a_src,b_src
71b7e3cc-5959-44e5-976f-ddb978680aa8,71b7e3cc-5959-44e5-976f-ddb978680aa8,Here's Why Nvidia (NVDA) is a Strong Growth Stock,Here's Why Nvidia (NVDA) is a Strong Growth Stock,0,GOLD,MARKETAUX
9d98c581-0269-4a64-a14d-9e9ca1038d49,9d98c581-0269-4a64-a14d-9e9ca1038d49,Asian shares decline despite rebound on Wall St as investors await next steps in trade wars,Asian shares decline despite rebound on Wall St as investors await next steps in trade wars,0,GOLD,MARKETAUX
2631a6ee-969e-4b75-9dcc-9a0a0e50abca,2631a6ee-969e-4b75-9dcc-9a0a0e50abca,MIN and Resmed CDI: 2 ASX shares to dig into,MIN and Resmed CDI: 2 ASX shares to dig into,0,GOLD,MARKETAUX
2631a6ee-969e-4b75-9dcc-9a0a0e50abca,aad03b0f-e156-4661-b24f-8bad25dbd543,MIN and Resmed CDI: 2 ASX shares to dig into,MIN and Resmed CDI: 2 ASX shares to dig into,0,GOLD,MARKETAUX
851fa39e-626b-44df-b22a-3f250c3bdd1d,851fa39e-626b-44df-b22a-3f250c3bdd1d,"The Zacks Analyst Blog Highlights Microsoft, Alphabet, Nvidia and Amazon","The Zacks Analyst Blog Highlights Microsoft, Alphabet, Nvidia and Amazon",0,GOLD,MARKETAUX
f506ae90-6cab-4cc8-8c20-8b3958fdca86,f506ae90-6cab-4cc8-8c20-8b3958fdca86,Twilio (TWLO) Increases Yet Falls Behind Market: What Investors Need to Know,Twilio (TWLO) Increases Yet Falls Behind Market: What Investors Need to Know,0,GOLD,MARKETAUX
199793f8-5357-4619-9331-104f890615f6,199793f8-5357-4619-9331-104f890615f6,"T-Mobile US, Inc. (TMUS): A Bull Case Theory","T-Mobile US, Inc. (TMUS): A Bull Case Theory",0,GOLD,MARKETAUX
27480ffa-1b55-4452-9946-f81f39032807,27480ffa-1b55-4452-9946-f81f39032807,Is Alphabet Inc. (GOOGL) the Top Stock to Buy According to Marshall Wace LLP?,Is Alphabet Inc. (GOOGL) the Top Stock to Buy According to Marshall Wace LLP?,0,GOLD,MARKETAUX
d02eb9a7-4e14-43bb-a7c7-6e16b58831c8,d02eb9a7-4e14-43bb-a7c7-6e16b58831c8,Markets Mixed As Tech Lags And Uncertainty Looms,Markets Mixed As Tech Lags And Uncertainty Looms,0,GOLD,MARKETAUX
2e935aa7-504f-4743-af48-679024e66601,2e935aa7-504f-4743-af48-679024e66601,3 major risks could send the stock market tumbling even further,3 major risks could send the stock market tumbling even further,0,GOLD,MARKETAUX
eb40682e-834c-46ca-9f29-335dc638a709,eb40682e-834c-46ca-9f29-335dc638a709,"Nvidia shares jump, and Honeywell makes an acquisition despite breakup plan","Nvidia shares jump, and Honeywell makes an acquisition despite breakup plan",0,GOLD,MARKETAUX
cf963234-6281-463e-b831-67464fc47606,cf963234-6281-463e-b831-67464fc47606,Meta Platforms (META) Awaits Impact of TikTok Policy Changes | META Stock News,Meta Platforms (META) Awaits Impact of TikTok Policy Changes | META Stock News,0,GOLD,MARKETAUX
1ec30685-081c-485e-bf8e-bb12c07ca565,1ec30685-081c-485e-bf8e-bb12c07ca565,Madison Square Garden Entertainment (MSGE) in John Rogers' Ariel Fund Q1 2024,Madison Square Garden Entertainment (MSGE) in John Rogers' Ariel Fund Q1 2024,0,GOLD,MARKETAUX
eee05ecf-95a8-4f30-b384-09e4483fdd34,eee05ecf-95a8-4f30-b384-09e4483fdd34,"OpenAI announces $500 bln ‘Stargate’ venture with Nvidia, Microsoft and Oracle By Investing.com","OpenAI announces $500 bln ‘Stargate’ venture with Nvidia, Microsoft and Oracle By Investing.com",0,GOLD,MARKETAUX
bcf8c096-71eb-469a-9393-f95da154fc76,bcf8c096-71eb-469a-9393-f95da154fc76,Insider Buying: Mitchell Klipper Acquires Shares of Steven Madden Ltd (SHOO),Insider Buying: Mitchell Klipper Acquires Shares of Steven Madden Ltd (SHOO),0,GOLD,MARKETAUX
50239d83-e0e9-4832-9dc3-d09977c22393,50239d83-e0e9-4832-9dc3-d09977c22393,Domino's Pizza Enterprises Limited (DPZUF) Q4 2024 Earnings Call Transcript,Domino's Pizza Enterprises Limited (DPZUF) Q4 2024 Earnings Call Transcript,0,GOLD,MARKETAUX
c8a48e2c-10eb-40d8-8a0f-3c6e8af0d333,c8a48e2c-10eb-40d8-8a0f-3c6e8af0d333,Tesla Stock Slowly Erasing Post-Election Day Rally,Tesla Stock Slowly Erasing Post-Election Day Rally,0,GOLD,MARKETAUX
2e53dea0-dcb3-42d7-a38e-a378e07f0e4d,2e53dea0-dcb3-42d7-a38e-a378e07f0e4d,"Stock market today: Dow, S&P 500, Nasdaq jump higher in countdown to Fed decision","Stock market today: Dow, S&P 500, Nasdaq jump higher in countdown to Fed decision",0,GOLD,MARKETAUX
3ee4ede2-def9-48ac-b50c-3f08538b98bf,3ee4ede2-def9-48ac-b50c-3f08538b98bf,"Amazon.com, Inc. (AMZN) Could See Big AI-Fuelled Growth, Says Analyst With ‘Buy’ Rating","Amazon.com, Inc. (AMZN) Could See Big AI-Fuelled Growth, Says Analyst With ‘Buy’ Rating",0,GOLD,MARKETAUX
65ec91f4-72e3-450c-a050-27f57198c53a,65ec91f4-72e3-450c-a050-27f57198c53a,"RumbleOn, Inc. Announces Leadership Changes","RumbleOn, Inc. Announces Leadership Changes",0,GOLD,MARKETAUX
3f80dd3e-8052-4f3d-95ad-c18e83158b26,3f80dd3e-8052-4f3d-95ad-c18e83158b26,Assessing Tesla Through The Basics Of Game Theory (NASDAQ:TSLA),Assessing Tesla Through The Basics Of Game Theory (NASDAQ:TSLA),0,GOLD,MARKETAUX
adb339e7-91a3-4693-8c20-a1378ad6d389,adb339e7-91a3-4693-8c20-a1378ad6d389,Wingstop (WING) Stock Drops Despite Market Gains: Important Facts to Note,Wingstop (WING) Stock Drops Despite Market Gains: Important Facts to Note,0,GOLD,MARKETAUX
a6f50fab-d55f-470f-9197-12a49a740e9d,a6f50fab-d55f-470f-9197-12a49a740e9d,Investors flock to Chinese herbal medicine stock with no revenues,Investors flock to Chinese herbal medicine stock with no revenues,0,GOLD,MARKETAUX
0348d7b2-9d89-474d-95aa-fab5d4589971,0348d7b2-9d89-474d-95aa-fab5d4589971,Banks: Treasury Should Raise Awareness on Paper Check Cuts,Banks: Treasury Should Raise Awareness on Paper Check Cuts,0,GOLD,MARKETAUX
ec1d9862-6be8-4f69-b5ab-92d4c9c0d077,ec1d9862-6be8-4f69-b5ab-92d4c9c0d077,Tethys Petroleum Annual Results and Corporate Update | TETHF Stock News,Tethys Petroleum Annual Results and Corporate Update | TETHF Stock News,0,GOLD,MARKETAUX
0a8fe22e-572d-4d0b-9022-bbb87a939d12,0a8fe22e-572d-4d0b-9022-bbb87a939d12,Archrock Inc. (AROC) Dips More Than Broader Market: What You Should Know,Archrock Inc. (AROC) Dips More Than Broader Market: What You Should Know,0,GOLD,MARKETAUX
33655063-fd05-45a9-8450-f56a3585ac25,33655063-fd05-45a9-8450-f56a3585ac25,Here's What Key Metrics Tell Us About EQT (EQT) Q4 Earnings,Here's What Key Metrics Tell Us About EQT (EQT) Q4 Earnings,0,GOLD,MARKETAUX
9b5e046b-c0ee-4944-9ebb-28bb10276775,9b5e046b-c0ee-4944-9ebb-28bb10276775,Weatherford International PLC Announces Upcoming Q2 2025 Earnings Call | WFRD stock news,Weatherford International PLC Announces Upcoming Q2 2025 Earnings Call | WFRD stock news,0,GOLD,MARKETAUX
bf09310b-3bbc-4fa5-ad6b-93bd6ea6ba7e,bf09310b-3bbc-4fa5-ad6b-93bd6ea6ba7e,Nov Inc. (NOV) Beats Q4 Earnings and Revenue Estimates,Nov Inc. (NOV) Beats Q4 Earnings and Revenue Estimates,0,GOLD,MARKETAUX
c79cf746-bde9-4957-8c39-c373d32b2189,c79cf746-bde9-4957-8c39-c373d32b2189,EU Shareholders Have the Right to Lead the enCore Energy Corp. Lawsuit - Contact the DJS Law Group to Discuss Your Rights - EU,EU Shareholders Have the Right to Lead the enCore Energy Corp. Lawsuit - Contact the DJS Law Group to Discuss Your Rights - EU,0,GOLD,MARKETAUX
ccedfbe9-2274-41f7-bbbd-477b86a72400,ccedfbe9-2274-41f7-bbbd-477b86a72400,Genworth (GNW) Upgraded with Promising Outlook Amid Legal Prospects | GNW Stock News,Genworth (GNW) Upgraded with Promising Outlook Amid Legal Prospects | GNW Stock News,0,GOLD,MARKETAUX
c792170e-a682-470a-ae05-8a9b24bf2f97,c792170e-a682-470a-ae05-8a9b24bf2f97,Visa Inc. (V): The Best Financial Stock Billionaires Are Investing In,Visa Inc. (V): The Best Financial Stock Billionaires Are Investing In,0,GOLD,MARKETAUX
9b6ab9f2-4562-4f61-9169-3d0061871739,9b6ab9f2-4562-4f61-9169-3d0061871739,Futures Rise As Market Awaits Outcome US-China Trade Talks,Futures Rise As Market Awaits Outcome US-China Trade Talks,0,GOLD,MARKETAUX
70ac49f1-a2ce-47e7-ac78-ff2542723f11,70ac49f1-a2ce-47e7-ac78-ff2542723f11,3 Stocks Hitting All-Time Highs With More Room to Run,3 Stocks Hitting All-Time Highs With More Room to Run,0,GOLD,MARKETAUX
49536355-ac51-4b4e-b11e-b1459ee3a91d,49536355-ac51-4b4e-b11e-b1459ee3a91d,Preliminary Q4 2024 Hypoport SE Earnings Call Transcript,Preliminary Q4 2024 Hypoport SE Earnings Call Transcript,0,GOLD,MARKETAUX
29cace49-35a8-4b09-a503-3cb4081a93b8,29cace49-35a8-4b09-a503-3cb4081a93b8,What are retail traders telling us?,What are retail traders telling us?,0,GOLD,MARKETAUX
30d0f74b-aa0d-4b95-bbf2-f20c4d920379,30d0f74b-aa0d-4b95-bbf2-f20c4d920379,"23andMe is exploring strategic alternatives, looking to raise capital","23andMe is exploring strategic alternatives, looking to raise capital",0,GOLD,MARKETAUX
a8e37227-0295-41ad-b689-d55d33a68e87,a8e37227-0295-41ad-b689-d55d33a68e87,UnitedHealth Group Incorporated (UNH): Among Defensive Stocks Billionaire Ken Fisher is Betting On,UnitedHealth Group Incorporated (UNH): Among Defensive Stocks Billionaire Ken Fisher is Betting On,0,GOLD,MARKETAUX
0c8e5195-c4c6-4a70-a0ee-b21707ffaac5,0c8e5195-c4c6-4a70-a0ee-b21707ffaac5,"Myriad Genetics, Inc. (MYGN) Showcases Breakthrough MRD Data and AI-Driven Cancer Tools at ASCO 2025","Myriad Genetics, Inc. (MYGN) Showcases Breakthrough MRD Data and AI-Driven Cancer Tools at ASCO 2025",0,GOLD,MARKETAUX
a68c633c-41db-4115-8933-817e0e7f5820,a68c633c-41db-4115-8933-817e0e7f5820,"Market Today: Consumer Sentiment Plummets, Palantir Gains on AI Developments","Market Today: Consumer Sentiment Plummets, Palantir Gains on AI Developments",0,GOLD,MARKETAUX
ba5b9ec5-0a6c-4a1b-8556-775527575a47,ba5b9ec5-0a6c-4a1b-8556-775527575a47,"Halozyme Therapeutics, Inc. 2024 Q4 - Results - Earnings Call Presentation (NASDAQ:HALO)","Halozyme Therapeutics, Inc. 2024 Q4 - Results - Earnings Call Presentation (NASDAQ:HALO)",0,GOLD,MARKETAUX
a17aaddb-9033-46f0-a42d-d4949b591ce2,a17aaddb-9033-46f0-a42d-d4949b591ce2,"Oscar Health, Inc. (OSCR) Declines More Than Market: Some Information for Investors","Oscar Health, Inc. (OSCR) Declines More Than Market: Some Information for Investors",0,GOLD,MARKETAUX
5b3a8454-c4b8-46e5-8039-2b459a607264,5b3a8454-c4b8-46e5-8039-2b459a607264,Futures Rise After Erasing 2025 Loss As Meltup Just Won't Stop,Futures Rise After Erasing 2025 Loss As Meltup Just Won't Stop,0,GOLD,MARKETAUX
70b7531c-2911-497e-bcc1-c239c8d901cf,70b7531c-2911-497e-bcc1-c239c8d901cf,First Patient Enrolled in NIH-Funded Expanded Access Program (EAP) Trial to Evaluate MN-166 in Amyotrophic Lateral Sclerosis (ALS) Patients,First Patient Enrolled in NIH-Funded Expanded Access Program (EAP) Trial to Evaluate MN-166 in Amyotrophic Lateral Sclerosis (ALS) Patients,0,GOLD,MARKETAUX
0014edb2-930b-4a26-9b98-903f848b4697,0014edb2-930b-4a26-9b98-903f848b4697,Mesoblast Financial Results and Corporate Update Webcast,Mesoblast Financial Results and Corporate Update Webcast,0,GOLD,MARKETAUX
183b96ac-8c2a-4b03-be47-0917deacbeb8,183b96ac-8c2a-4b03-be47-0917deacbeb8,Cadeler A/S (CDLR) Q4 2024 Earnings Call Transcript,Cadeler A/S (CDLR) Q4 2024 Earnings Call Transcript,0,GOLD,MARKETAUX
94d60a82-3b0f-4072-9d4c-e9029e4f5aac,94d60a82-3b0f-4072-9d4c-e9029e4f5aac,"Benzinga Bulls And Bears: Nvidia, Micron, HIMS — And Markets Soar On Mideast And Tariff Relief Benzinga Bulls And Bears: Nvidia, Micron, HIMS — And Markets Soar On Mideast And Tariff Relief","Benzinga Bulls And Bears: Nvidia, Micron, HIMS — And Markets Soar On Mideast And Tariff Relief Benzinga Bulls And Bears: Nvidia, Micron, HIMS — And Markets Soar On Mideast And Tariff Relief",0,GOLD,MARKETAUX
faa8899e-6dcb-472f-ae5f-37dd1f2b7237,faa8899e-6dcb-472f-ae5f-37dd1f2b7237,Liberty Gold Reports Year-End 2024 Financial and Operating Results,Liberty Gold Reports Year-End 2024 Financial and Operating Results,0,GOLD,MARKETAUX
b9b1e7a8-b4d2-47a1-852c-30f0b31734d2,b9b1e7a8-b4d2-47a1-852c-30f0b31734d2,Lennox International Inc (LII) and Ariston Group Announce Joint Venture for Water Heaters in North America | LII stock news,Lennox International Inc (LII) and Ariston Group Announce Joint Venture for Water Heaters in North America | LII stock news,0,GOLD,MARKETAUX
c4af0444-bb25-4ecc-9530-e4588e5df3da,c4af0444-bb25-4ecc-9530-e4588e5df3da,Aecon announces voting results of Annual General Meeting,Aecon announces voting results of Annual General Meeting,0,GOLD,MARKETAUX
0baaf2da-b38a-4148-90c3-922ae87a508d,0baaf2da-b38a-4148-90c3-922ae87a508d,3 Renewable Energy Stocks to Buy in 2025 and Hold for Decades,3 Renewable Energy Stocks to Buy in 2025 and Hold for Decades,0,GOLD,MARKETAUX
a80a52ea-b1af-4b66-b736-78c9298bed0a,a80a52ea-b1af-4b66-b736-78c9298bed0a,Costco Wholesale Corporation (COST): Among Defensive Stocks Billionaire Ken Fisher is Betting On,Costco Wholesale Corporation (COST): Among Defensive Stocks Billionaire Ken Fisher is Betting On,0,GOLD,MARKETAUX
e72a984a-e049-4eef-8043-bfdccab0e228,e72a984a-e049-4eef-8043-bfdccab0e228,Price Over Earnings Overview: Healthpeak Properties - Healthpeak Properties (NYSE:DOC),Price Over Earnings Overview: Healthpeak Properties - Healthpeak Properties (NYSE:DOC),0,GOLD,MARKETAUX
c3454416-75ee-4e4e-be18-55e5ed2f750b,c3454416-75ee-4e4e-be18-55e5ed2f750b,Looking for Resilient Singapore REITs? These 3 Could be Perfect for Your Portfolio,Looking for Resilient Singapore REITs? These 3 Could be Perfect for Your Portfolio,0,GOLD,MARKETAUX
4ee6b5d4-5dfd-486e-9117-beba96beaeae,4ee6b5d4-5dfd-486e-9117-beba96beaeae,Here's What Key Metrics Tell Us About Brandywine Realty Trust (BDN) Q4 Earnings,Here's What Key Metrics Tell Us About Brandywine Realty Trust (BDN) Q4 Earnings,0,GOLD,MARKETAUX
b0529e17-c80a-4c74-9273-b0255b3125d1,b0529e17-c80a-4c74-9273-b0255b3125d1,Bear Thesis Crushed As Massive Deal Leaves Bears Speechless: Sun Communities (NYSE:SUI),Bear Thesis Crushed As Massive Deal Leaves Bears Speechless: Sun Communities (NYSE:SUI),0,GOLD,MARKETAUX
c138a61b-5d76-41ab-bc06-14786219ba6c,c138a61b-5d76-41ab-bc06-14786219ba6c,Insider Buying: Mark Winmill Acquires Additional Shares of Global Self Storage Inc (SELF),Insider Buying: Mark Winmill Acquires Additional Shares of Global Self Storage Inc (SELF),0,GOLD,MARKETAUX
99603054-0f9d-4eb5-b951-5b2d237b31d1,99603054-0f9d-4eb5-b951-5b2d237b31d1,"Fathom Holdings chief broker officer sells $1,260 in stock By Investing.com","Fathom Holdings chief broker officer sells $1,260 in stock By Investing.com",0,GOLD,MARKETAUX
c6bbff6d-0db7-4924-a9fc-3f62b2303088,c6bbff6d-0db7-4924-a9fc-3f62b2303088,DoubleVerify Holdings (DV) Stock Receives Reaffirmed Buy Rating from Needham | DV Stock News,DoubleVerify Holdings (DV) Stock Receives Reaffirmed Buy Rating from Needham | DV Stock News,0,GOLD,MARKETAUX
a4b289ef-32f6-4ef3-981d-c05f4ff18632,a4b289ef-32f6-4ef3-981d-c05f4ff18632,A deep dive into RMD shares,A deep dive into RMD shares,0,GOLD,MARKETAUX
87b5fb56-b2c9-4823-ab52-a660d0a56751,87b5fb56-b2c9-4823-ab52-a660d0a56751,"The Law Offices of Frank R. Cruz Continues Its Investigation of DoubleVerify Holdings, Inc. (DV) on Behalf of Investors","The Law Offices of Frank R. Cruz Continues Its Investigation of DoubleVerify Holdings, Inc. (DV) on Behalf of Investors",0,GOLD,MARKETAUX
6be70d8d-0c40-424c-9ee4-13785a4bed89,6be70d8d-0c40-424c-9ee4-13785a4bed89,Mercury Insurance Gives Update on Primary Mission: Helping Policyholders Affected by the Southern California Wildfires,Mercury Insurance Gives Update on Primary Mission: Helping Policyholders Affected by the Southern California Wildfires,0,GOLD,MARKETAUX
997c7155-a6f6-420d-abee-fc4b67f8ce5c,997c7155-a6f6-420d-abee-fc4b67f8ce5c,DoubleVerify (DV) Target Price Reduced by Raymond James | DV Stock News,DoubleVerify (DV) Target Price Reduced by Raymond James | DV Stock News,0,GOLD,MARKETAUX
6ddb36e7-5697-4d98-8d5d-7d10b47e51c2,6ddb36e7-5697-4d98-8d5d-7d10b47e51c2,PPL (PPL) Stock Declines While Market Improves: Some Information for Investors,PPL (PPL) Stock Declines While Market Improves: Some Information for Investors,0,GOLD,MARKETAUX
1ff1074d-1809-4f58-a8f9-ae276542a469,1ff1074d-1809-4f58-a8f9-ae276542a469,Rare snowstorm blankets Houston and New Orleans in white By Reuters,Rare snowstorm blankets Houston and New Orleans in white By Reuters,0,GOLD,MARKETAUX
123ec630-4d2c-4cef-9e45-a8155b65968c,123ec630-4d2c-4cef-9e45-a8155b65968c,"This Rollins Analyst Begins Coverage On A Bullish Note; Here Are Top 5 Initiations For Tuesday - Fossil Group (NASDAQ:FOSL), New Fortress Energy (NASDAQ:NFE)","This Rollins Analyst Begins Coverage On A Bullish Note; Here Are Top 5 Initiations For Tuesday - Fossil Group (NASDAQ:FOSL), New Fortress Energy (NASDAQ:NFE)",0,GOLD,MARKETAUX
cb2bd9c5-f027-4411-9c6f-4654451db35c,cb2bd9c5-f027-4411-9c6f-4654451db35c,"Insider Sell: Ulice Payne Sells 1,150 Shares of WEC Energy Group Inc (WEC)","Insider Sell: Ulice Payne Sells 1,150 Shares of WEC Energy Group Inc (WEC)",0,GOLD,MARKETAUX
73bc11eb-be18-43de-a82a-5a530eee4556,73bc11eb-be18-43de-a82a-5a530eee4556,NRG Energy Inc (NRG) Shares Gap Down to $149.9625 on Jun 10,NRG Energy Inc (NRG) Shares Gap Down to $149.9625 on Jun 10,0,GOLD,MARKETAUX
56d07c81-ab70-40d0-b330-7e7c8dc047e8,56d07c81-ab70-40d0-b330-7e7c8dc047e8,AES Announces Pricing Terms of Cash Tender Offer for Any and All of Its 3.300% Senior Notes due 2025,AES Announces Pricing Terms of Cash Tender Offer for Any and All of Its 3.300% Senior Notes due 2025,0,GOLD,MARKETAUX
207f648d-acf8-44a9-b0bd-4ba472c87f53,207f648d-acf8-44a9-b0bd-4ba472c87f53,Nvidia: The Bull Case Just Got Stronger (NASDAQ:NVDA),Nvidia: The Bull Case Just Got Stronger (NASDAQ:NVDA),0,GOLD,MARKETAUX
ad3d4a2b-35c3-43f3-82f1-4eea78ca7b58,ad3d4a2b-35c3-43f3-82f1-4eea78ca7b58,"Tudor Investment's Q4 moves include buying Intel stake, trimming Nvidia","Tudor Investment's Q4 moves include buying Intel stake, trimming Nvidia",0,GOLD,MARKETAUX
b39dbae8-35d9-4b85-b714-6abffafd479e,b39dbae8-35d9-4b85-b714-6abffafd479e,Nvidia Stock: Competitive Threats Are Too Big To Ignore (NASDAQ:NVDA),Nvidia Stock: Competitive Threats Are Too Big To Ignore (NASDAQ:NVDA),0,GOLD,MARKETAUX
e933def5-2781-4dd0-a3bd-77b35adb106c,e933def5-2781-4dd0-a3bd-77b35adb106c,JD.Com: A Capital Return Play For 2025 (NASDAQ:JD),JD.Com: A Capital Return Play For 2025 (NASDAQ:JD),0,GOLD,MARKETAUX
50d71ecf-691a-4098-95c5-156eaab2826b,50d71ecf-691a-4098-95c5-156eaab2826b,"AMD: Not Second Best To Nvidia, But It's The Smarter Bet (NASDAQ:AMD)","AMD: Not Second Best To Nvidia, But It's The Smarter Bet (NASDAQ:AMD)",0,GOLD,MARKETAUX
5621e32e-c91e-4c5a-ad08-656ab4000a5a,5621e32e-c91e-4c5a-ad08-656ab4000a5a,"US stocks end higher as traders focus on tariffs, data","US stocks end higher as traders focus on tariffs, data",0,GOLD,MARKETAUX
93af2440-686c-4858-92de-98e162f8d3b9,93af2440-686c-4858-92de-98e162f8d3b9,5 High-Growth US Stocks Leading the Future of Business,5 High-Growth US Stocks Leading the Future of Business,0,GOLD,MARKETAUX
92ace4b8-da50-4d29-8ff2-181aef415acb,92ace4b8-da50-4d29-8ff2-181aef415acb,Why Intel (INTC) Stock is Dropping Today,Why Intel (INTC) Stock is Dropping Today,0,GOLD,MARKETAUX
4b779a8f-f165-4741-93d8-a39084555c71,4b779a8f-f165-4741-93d8-a39084555c71,Advanced Micro Devices (AMD): Among Stocks That Will Profit From AI,Advanced Micro Devices (AMD): Among Stocks That Will Profit From AI,0,GOLD,MARKETAUX
24a5a923-0116-41ce-8ee3-dad8a439602e,24a5a923-0116-41ce-8ee3-dad8a439602e,Intel shares jump 15% following new CEO appointment,Intel shares jump 15% following new CEO appointment,0,GOLD,MARKETAUX
8e53dc55-4c6f-48d1-895c-c60046c960be,8e53dc55-4c6f-48d1-895c-c60046c960be,Stock Market Today: Markets Decline Amid Middle East Tensions,Stock Market Today: Markets Decline Amid Middle East Tensions,0,GOLD,MARKETAUX
86b05b35-34b1-4ea6-a66c-3154c6a94d5c,86b05b35-34b1-4ea6-a66c-3154c6a94d5c,"Headlines Today in Finance, Technology & Geopolitics — The Chips That Rule the World","Headlines Today in Finance, Technology & Geopolitics — The Chips That Rule the World",0,GOLD,MARKETAUX
04f27087-bcb0-4c03-88e5-882560e6123e,04f27087-bcb0-4c03-88e5-882560e6123e,TSLA Leads Tech Rebound as Fed Maintains Interest Rates Unchanged,TSLA Leads Tech Rebound as Fed Maintains Interest Rates Unchanged,0,GOLD,MARKETAUX
ce39247d-d124-46d6-9788-47aee74fb54b,ce39247d-d124-46d6-9788-47aee74fb54b,Buy Or Sell Nvidia Stock Ahead Of Earnings?,Buy Or Sell Nvidia Stock Ahead Of Earnings?,0,GOLD,MARKETAUX
ec2666c3-ce3e-4ea6-8b88-c3993788c8fb,ec2666c3-ce3e-4ea6-8b88-c3993788c8fb,NVIDIA Blackwell Ultra DGX SuperPOD Delivers Out-of-the-Box AI Supercomputer for Enterprises to Build AI Factories,NVIDIA Blackwell Ultra DGX SuperPOD Delivers Out-of-the-Box AI Supercomputer for Enterprises to Build AI Factories,0,GOLD,MARKETAUX
7f5beebf-7321-43a5-93dd-ae686ba78ae5,7f5beebf-7321-43a5-93dd-ae686ba78ae5,Hewlett Packard Enterprise Enhances Robust Compute Platforms for Mission-Critical Operations,Hewlett Packard Enterprise Enhances Robust Compute Platforms for Mission-Critical Operations,0,GOLD,MARKETAUX
84fb94b0-4d1f-44ec-9fb0-de1b0eff7629,84fb94b0-4d1f-44ec-9fb0-de1b0eff7629,Is Super Micro Computer Inc. (SMCI) the Best Affordable Tech Stock to Buy According to Analysts?,Is Super Micro Computer Inc. (SMCI) the Best Affordable Tech Stock to Buy According to Analysts?,0,GOLD,MARKETAUX
6464700c-1d5a-4110-811e-b10992efd34c,6464700c-1d5a-4110-811e-b10992efd34c,"NetApp Storage Now Validated for NVIDIA DGX SuperPOD, NVIDIA Cloud Partners, and NVIDIA-Certified Systems","NetApp Storage Now Validated for NVIDIA DGX SuperPOD, NVIDIA Cloud Partners, and NVIDIA-Certified Systems",0,GOLD,MARKETAUX
d96411f9-8dd6-4182-9077-8f3cab3fca17,d96411f9-8dd6-4182-9077-8f3cab3fca17,"Advanced Micro Devices, Inc. (AMD) Is a Trending Stock: Facts to Know Before Betting on It","Advanced Micro Devices, Inc. (AMD) Is a Trending Stock: Facts to Know Before Betting on It",0,GOLD,MARKETAUX
b7bc6615-f74b-4460-8eee-5b55dd8f5a6a,b7bc6615-f74b-4460-8eee-5b55dd8f5a6a,Market Recap: Stocks Plummet as Trump Tariffs Trigger Global Selloff,Market Recap: Stocks Plummet as Trump Tariffs Trigger Global Selloff,0,GOLD,MARKETAUX
b4ff08b0-66db-465b-a08a-411c7002a678,b4ff08b0-66db-465b-a08a-411c7002a678,"Advanced Micro Devices, Inc. (AMD) Gains Boost As Bank Of America Raises Target On AI Deal Momentum","Advanced Micro Devices, Inc. (AMD) Gains Boost As Bank Of America Raises Target On AI Deal Momentum",0,GOLD,MARKETAUX
a6838400-5e8d-4ab9-94bb-eee4affe431f,a6838400-5e8d-4ab9-94bb-eee4affe431f,Futures Flat Ahead Of Payrolls,Futures Flat Ahead Of Payrolls,0,GOLD,MARKETAUX
a420a414-3b6c-4918-8525-a4df65369d51,a420a414-3b6c-4918-8525-a4df65369d51,U.S. Stocks Close Mixed After Early Move To The Upside,U.S. Stocks Close Mixed After Early Move To The Upside,0,GOLD,MARKETAUX
4a3d83ae-1dd7-4739-93b8-8f8432aa47a2,4a3d83ae-1dd7-4739-93b8-8f8432aa47a2,Analogies for AI policymaking,Analogies for AI policymaking,0,GOLD,MARKETAUX
c80cd47c-d4fd-47a9-ba35-1f4598ea8f92,c80cd47c-d4fd-47a9-ba35-1f4598ea8f92,Jim Cramer Asserts that NVIDIA Corporation (NVDA) Will Experience Sizeable Demand,Jim Cramer Asserts that NVIDIA Corporation (NVDA) Will Experience Sizeable Demand,0,GOLD,MARKETAUX
c0365ecc-64a0-47d1-be39-72b9c7dc4d74,c0365ecc-64a0-47d1-be39-72b9c7dc4d74,"Which AI stock, NVIDIA or Broadcom, is a Better Buy Now?","Which AI stock, NVIDIA or Broadcom, is a Better Buy Now?",0,GOLD,MARKETAUX
5cc915ec-58c0-4920-9693-ad2a1636a025,5cc915ec-58c0-4920-9693-ad2a1636a025,AMD Surges as Citi Raises Price Target to $120 Before AI Event,AMD Surges as Citi Raises Price Target to $120 Before AI Event,0,GOLD,MARKETAUX
0cfce753-d2bd-4c2b-b1a3-5cc7699afdcc,0cfce753-d2bd-4c2b-b1a3-5cc7699afdcc,Time for a Strategic Shift,Time for a Strategic Shift,0,GOLD,MARKETAUX
bd37651c-bc27-458a-ab9a-afff20004a4d,bd37651c-bc27-458a-ab9a-afff20004a4d,"Nvidia: From DeepSeek To Trade War, Loading Up At $100 Before Q4 (Upgrade) (NASDAQ:NVDA)","Nvidia: From DeepSeek To Trade War, Loading Up At $100 Before Q4 (Upgrade) (NASDAQ:NVDA)",0,GOLD,MARKETAUX
337aa671-ded5-4257-b6f7-9ca1299981a9,337aa671-ded5-4257-b6f7-9ca1299981a9,Futures Plunge As German Bond Rout Goes Global,Futures Plunge As German Bond Rout Goes Global,0,GOLD,MARKETAUX
6979c8a9-3014-421d-9949-fc279b755feb,6979c8a9-3014-421d-9949-fc279b755feb,Wall Street Brunch: DOGE In The Jobs Data?,Wall Street Brunch: DOGE In The Jobs Data?,0,GOLD,MARKETAUX
1a855ca2-3ec6-4d70-9862-d5a48a02f1cb,1a855ca2-3ec6-4d70-9862-d5a48a02f1cb,Look The F*ck Out Below,Look The F*ck Out Below,0,GOLD,MARKETAUX
c8fe2518-640f-4e0b-878e-16078aee54c1,c8fe2518-640f-4e0b-878e-16078aee54c1,"Intel: New CEO, Same Old Game Plan (NASDAQ:INTC)","Intel: New CEO, Same Old Game Plan (NASDAQ:INTC)",0,GOLD,MARKETAUX
5db2d1c5-ce82-42bc-93c4-84a4fb86c266,5db2d1c5-ce82-42bc-93c4-84a4fb86c266,Is Rigetti Computing Stock a Buy?,Is Rigetti Computing Stock a Buy?,0,GOLD,MARKETAUX
e488caed-5484-4eef-abfb-e6f3fdd76d8f,e488caed-5484-4eef-abfb-e6f3fdd76d8f,"Advanced Micro Devices, Inc. (AMD) is Attracting Investor Attention: Here is What You Should Know","Advanced Micro Devices, Inc. (AMD) is Attracting Investor Attention: Here is What You Should Know",0,GOLD,MARKETAUX
e488caed-5484-4eef-abfb-e6f3fdd76d8f,8779b64b-f828-42d5-a140-5e6f09f78d35,"Advanced Micro Devices, Inc. (AMD) is Attracting Investor Attention: Here is What You Should Know","Advanced Micro Devices, Inc. (AMD) is Attracting Investor Attention: Here is What You Should Know",0,GOLD,MARKETAUX
cafde5ef-cd3f-48af-b4cc-6acc857c59a9,cafde5ef-cd3f-48af-b4cc-6acc857c59a9,Nvidia’s New Chips Boost Stock Amid Buzz at ’Super Bowl of AI’,Nvidia’s New Chips Boost Stock Amid Buzz at ’Super Bowl of AI’,0,GOLD,MARKETAUX
7c30286d-db39-4f22-a85b-5904613509de,7c30286d-db39-4f22-a85b-5904613509de,Stock Market Today: Nasdaq Leads Gains as Tech Rallies; OECD Cuts Growth Outlook,Stock Market Today: Nasdaq Leads Gains as Tech Rallies; OECD Cuts Growth Outlook,0,GOLD,MARKETAUX
13b28c87-e92e-4ce4-8297-0b820596f1da,13b28c87-e92e-4ce4-8297-0b820596f1da,U.S. stock market falls amid consumer pessimism,U.S. stock market falls amid consumer pessimism,0,GOLD,MARKETAUX
